category,text,dset
covid,53 workers infected covid-19 53 workers were identified as atk positive from weekly atk test and then ips were confirmed by hospital and home isolation. 1. subcontractor disinfected the working area & temporary office. and increased disinfection 2 times/day at temporary canteen. 2. provided daily inspection checklist for covid 19 measurement. 3. isolate high risk/close contact out off working. 4. covid 19 measure walkdown. 5. inform to all employees about the who are high risk from family and high risk from house rental must be inform covid 19 coordinator immediately.,ORGP
"fuel spill or leak, hydraulic fluid or oil leak","minor oil spill (hydraulic oil) from tractor exiting site onto a713 to west of brownhill gate minor oil spill (hydraulic oil) from tractor exiting site onto a713 to west of brownhill gate. a thin spray of hydraulic oil was discovered along a section of road (c.200m) and in a small parking area just off the a713 opposite the site entrance where the tractor had pulled into.  absorbent pads were deployed beneath the tractor to contain any further leaks until a fitter arrived to inspect the plant. it is likely that around 2-4l of oil was spilt. the access track was scraped by a grader and the contaminated stone placed in hazardous waste bags. this will be taken to the yard for disposal by a licensed waste carrier. the small parking area will be scraped later today to remove any contaminated stone once the fitter has repaired the machine. no harm was caused to the surrounding environment as a result of the spill, the weather was dry all day. ",ORGP
head or face injury,"operator reported feeling discomfort/irritation to their face after they began to perspire. on june 24th, 2021, at approx. 15:15 a wood operator reported discomfort to their face. the operator had been working at the reaction tank area and had been exposed to some fly ash that traveled over to their work area from the fly ash loading area (dry loaders) earlier in their shift. as the operator later on began sweating, they felt a burning sensation to their face. incident potential rating set at b-2 for the potential of requiring medical treatment. ip immediately reported incident to their supervisor, ert was called and provided first aid. occucare was consulted and ip returned to work with instructions to follow up at the end of shift or immediately if condition worsens. follow up conducted with ip and occucare the following day and was provided instructins for care and returned to work. no further discomfort reported.",ORGP
covid,employee communicated a positive confirmation for covid-19  an employee reported a confirmed positive test for covid-19 to site management. the employee has been in isolation since october 5th. wood is identifying those who may have worked in proximity.  appropriate notifications have been completed. this is the eight positive result for the 6th of october. ,ORGP
*** Not Classified,"terra-mat failed with a stationary track hoe on it causing the trackhoe to sink in saturated soil.  at 3:00pm on crossingville road in albion pennsylvania, an equipment operator was tasked with digging ditch in an area of the project that was terra-matted due to saturated soil conditions in the travel lane.  the mats were double stacked in the area to improve integrity.  while the equipment was stationary on the mats, the trackhoe and mats both began to sink.  the equipment operator immediately shut down the equipment, and moved to a safe location.  the crew re-grouped and decided it was best to make an alternate mat route to avoid the saturated soil. added terra-mats around the affected area for equipment stability purposes.",ORGP
vehicle incident general,"non preventable, rental vehicle, minor damage, no injuries. the employee was driving on an icy road and was about to make a right turn to pull into a parking lot of a shopping center. the car slid a bit, causing the other vehicle behind to rear end the rear passenger side of the employee vehicle. no injuries reported. damaged was incurred on both vehicles. a report was filed by the employee with avis. information exchanged with 3rd party driver, incident reported to avis rental agency, hse coordinator, and hse manager.",ORGP
*** Not Classified,"failure to tape assumed asbestos flanged joints prior to destruct on the 11th february 2020 it was highlighted that a 4"" 150# ball valve destructed under the c2 leg pipework clearance scope. it was then removed from the worksite and placed in a skip for backload. this valve under the level 2 risk assessment was identified with the potential for asbestos and was to be controlled by taping the joints and cut each side of the flange to ensure no disturbance of the potential caf gasket. the valve was cold cut each side of the flange as per decom procedure but was removed without the flange joints being taped.  personnel were not exposed to the potential caf gasket as the flange had not been broken. valve was recovered from the incorrect skip, taped and will be back loaded under asbestos controls.individual within the work scope was interviewed and provided a witness statement giving his account of events. ",ORGP
"line of fire, slips & trips",hydraulic jack parted from pump shaft end migrated from legacy cairs incident #32100during jacking of coupling hub onto a pump shaft the bolts holding the jack onto the motor shaft stripped the threads of the pump holes.this threw the jack back from the force of the hydraulic pressure. personnel were not in the line of fire when this occurred.job was stopped with worksite made safe and incident reported through the line to immediate supervisor.this task was being conducted by vendor (john crane) with assistance only being provided by wg.technical investigation complete and attached along with procedure and drawings migrated from legacy cairs - see detailed description,ORGP
slips & trips,"same level fall while walking on asphalt facility road team member was walking from the fiberline area to the wood office complex along asphalt roadway and tripped when work boot gripped pavement, resulting in a same level fall, landing on their hip after attempting to catch themselves. actual severity rated as b3 as the individual received medical treatment, then surgery.  kept overnight in hospital after surgery. potential severity selected as b3 as a lost time injury did occur but unlikely that a more serious outcome could have resulted. team member contacted supervision and was escorted to the wood safety office for evaluation. occucare was contacted and the team member was taken to medical facility for review, where medical treatment was rendered.level 2 investigation team under tor was assigned.on march 9, 2021 - a disposition of recordability was approved for reclassify as non-work related incident.",ORGP
hand or arm injury,strain to left arm. employee reported a sore left hand/arm as a result of clearing weeds to prepare for archaeological unit excavation. employee contacted workcare and elected self care. ,ORGP
*** Not Classified,"missing key for client's office which was in the care of wood wood have been provided with a key to access a client's site so that water monitoring visits can be undertaken. it was discovered on the day that the second visit was to be undertaken that the key was not in the folder where it had previously been placed. all locations, home, car and offices have been searched but it has not been possible to locate the key. the site contact was immediately informed and the incident has been reported to the client's she desk as a security incident. an incident report is being produced for the client.",ORGP
lifting or moving loads,"during pickup of subcontractor dumpsters on site, a pile of solar modules was struck by the loading truck. during pick up of dumpsters on site for a subcontractor for final removal from site, the loading truck ran into a pallet of replacement modules, damaging 5 of the 9 modules. the truck had made 4 trips to site today and during that time is when the incident occurred. no injuries as no one was working in the area. pictures were taken of the scene to show tire tracks leading from the dumpster location and the module pallet. ",ORGP
vehicle incident general,"road traffic accident occurred between a wood subcontracted vehicle and a train. no injuries resulted from this incident. on the 6th of march at 15:25hrs a wood sub-contracted vehicle picked up a wood employee to begin the journey to the employee's home. at around 15:30hrs the vehicle was involved in a collision with a train, whilst the vehicle was attempting to cross the train tracks. there is no injuries results from this incident however the employee phoned the emergency response number as in the er plan. photos of the scene were taken and an investigation initiated. er process followed, scene was secured. photos of the area was taken witness statements was taken from the involved parties an investigation was initiated.   ",ORGP
line of fire,"pipe rolled in the rack and damaged a scaffold pole (top rail). on 10/18/2018, at approximately 16:30, a piece of 30” heavy wall pipe with an elbow was set in the east west pipe rack.  the piece was a 44’3” section with a 90-degree elbow on the west side; this piece was laid to rest running east to west.  due to time constraints the pipe was not on the desired coordinates but was lashed down for the evening.the task resumed the following day.  the east end (shoe side) of the piece of pipe containing the elbow was placed on coordinates.  one of the pipe fitters was placed in position on a scaffold to ensure it stayed on coordinates while the west end containing the elbow was moved.  the foreman of the pipe crew wanted to move the west end 2” to the north.  the reason it was supposed to move to the north is that the straight run piece of pipe that was in the rack already was not on coordinates and had to move to the north and to the west several inches in both directions to be on the proper coordinates.the rigging used to pick the west end of the pipe would not be good for a choke hitch, so the rigger chose to basket the load.  as he was coming up on the load, the cribbing which the pipe was resting on was repositioned by the pipe department.  the cribbing was moved too far to the southeast.  as the cribbing was moved, some of it was removed which created a lower elevation for the pipe to rest on.  as the rigger had the crane cable the load down the cribbing was off-center causing the elbow to roll upward in the rigging slowly.the weight of the pipe (22,000 pounds) was set down and rested on the east side toprail of the scaffold which caused the top rail to bend.  no one was in the line of fire of the elbow as it moved.  the total load of the pipe was never completely released from the crane. work stopped and everyone was brought down out of the rack.  ineos showed up prior to being notified.  the pipe was brought to the ground and the area was made safe.  the scaffold builders did a thorough inspection of the scaffold and replaced the damaged top rail.",ORGP
covid,"wood employee was on board at ppm-1 and started to feeling symptoms. he disembarked and performed an rt / pcr test with a positive the employee was embarked on ppm-1 and disembarked on october 25th. he performed (at hotel) an rt / pcr test on october 26th. we recived the positive result on october 26th. he is symptomatic with loss of smell and taste the worker has symptoms, such as lack of taste and smell, but is doing well. he received guidance from the nursing technician regarding the necessary care. the worker will stay at the hotel for a quarantine period.",ORGP
foot or leg injury,"the employee was handling an equipment, when he accidentally hit a box with other materials, leading the box to roll and fall into his right shin. he went to the hospital for medical evaluation, and release to go back to work (only small bruise). migrated from legacy cairs incident #37951while handling a tubular caterpillar spare part, the end of the equipment touched another part that was not properly stored (the equipment was loose and on top of a similar equipment), making it to roll and hit the shin of the employee. the employee suffered a small bruise in the right shin. the ip reported and went to the hospital for medical evaluation. the doctor performed a first aid and released the employee back to his normal duties.what: a package/box with material roll and hit an employee shin;where: whpb;when: this incident happened approx. at 15h15min;why: the package/box was not properly stored/fixed. migrated from legacy cairs - see detailed description",ORGP
hand or arm injury,"operator was working with cutting of metal plates, using a grinder. while doing this his right little finger came in briefly contact with the grinding wheel, which led to a minor, graze injury. the operator contacted medic, for disinfection and pla migrated from legacy cairs incident #32414what:operator was working with cutting of metal plates, using a grinder. while doing this his right little finger came in briefly contact with the grinding wheel, which led to a minor, graze injury. the operator contacted medic, for disinfection and plaster.where: norway, statoil installation snorre b, welding shopwhen: 13.02.2017why:cause: not use of correct personal protective equipment. undesirable behavior - inadequate attention / care migrated from legacy cairs - see detailed description",ORGP
back injury,"back pain from snowmobile use accessing project area required approximately 4km of snowmobling through difficult contitions (deep powdery snow, areas of alder regrowth, downed trees). due to adverse conditions snowmobilies became routinely stuck while attempting to break trail. first lower back pain was noticed when pushing lead snowmobile forward with coworker, while another coworker rocked the front of the snowmobile side-to-side while working the throttle after the snowmobile became stuck again (approximately 2 km from the truck on the way to the development). pain increased on the drive back to fort st. john after affected area was inactive for a while. employee contacted workcare and they provided a consult.  injury / pain subsided without the need for any treatment.",ORGP
covid,employee communicated a positive confirmation for covid-19  an employee reported a confirmed positive test for covid-19 to site management. the employee has been in isolation since october 1st. wood is identifying those who may have worked in proximity.  appropriate notifications have been completed. this is the first of two positive results reported for the 2nd of october.,ORGP
*** Not Classified,plastic cup from air filter regulator was found in numerous pieces on the ground around its fitted location. migrated from legacy cairs incident #34346whilst undertaking a plant site tour a plastic cup from air filter regulator was found in numerous pieces on the ground around its fitted location. further inspection of similar cups show aging of the plastic through age and service. photographs attached. migrated from legacy cairs - see detailed description,ORGP
*** Not Classified,"electrical cable unravelled and slowly descended down a secured centenary cable as cable ties released from a total height of approx. 16m electrical cable has unravelled and slowly descended down a secured centenary cable as cable ties (securing point) has released from a total height of approx. 16m. this has been carried out all within the confines of a controlled drop zone.  job stopped, hse notified, and investigation commenced ",ORGP
covid,ip tested +ve for covid ip tested +ve for covid ip in contact with line manager,ORGP
covid,"positive covid-19 test results employee confirmed positive test results received on july 6, 2020. employee self isolated upon onset of symptoms.  contact tracing conducted.",ORGP
vehicle incident general,"mva, non preventable, company vehicle, major damage, no injuries while traveling to a meeting in savannah, ga a deer ran in front of truck #1935, causing front end damage and deploying both driver's air bag and passenger curtain air bag reporting procedures followed.",ORGP
hand or arm injury,"ip suffered laceration to index finger while carrying out engineering work on dunlin donut station a, the ip was moving a mag drill from one location to another.  ip suffered a laceration to the index finger on the right hand.  ip visited medic. medic asked for advice from topsides doctor. ip medevac'd to ari",ORGP
"mechanical or equipment issue, line of fire, foot or leg injury","a wood employee caught his leg between a bolt and a torque wrench and felt discomfort to the side of his left knee. at approximately 3:30 pm 16 october 2019, a wood pipe fitter was installing a blind flange. as he tightened the bolts with a torque wrench, he caught his leg between a bolt and the torque wrench. the employee immediately felt discomfort to the side of his left knee. the employee reported the incident to his foreman, who then reported it to wood safety. the employee was then transported to the local offsite clinic for evaluation. the employee was evaluated and released back to work with first aid treatment. employee was taken to off site clinic. employee was evaluated and released back to work with first aid treatment. discussion was had with remaining crew members about line of fire safety.",ORGP
covid,"wood employee tested positive for covid 19 wood employee tested positive for covid 19 on february 19, 2021. ee is experiencing mild symptoms. contact tracing has been completed. ee reported the positive test results to management. ",ORGP
covid,"contractor visitor tested covid positive a visitor from the contractor came to site on thursday 8th july, this person reported a positive lateral flow test on friday morning (9th) contractor project manager reported covid positive case to wood management team, contractor management team and superintendent also carried out voluntary lateral flow tests over the weekend - all negativework station cleaned down immediately by cleaning contractor teamall social distancing, face covering and hygiene requirements were followed by all individuals on site ",ORGP
fuel spill or leak,"at approximately 1340hrs a production operator observed liquid discharging from the diesel coalescer atmospheric vent line on the north side engie project - cygnus alpha - at approximately 1340hrs a production operator observed liquid discharging from the diesel coalescer atmospheric vent line on the north side of the pu cellar deck. he immediately notified the ccr via radio who proceeded to shut in the crane pedestal diesel outlet valve (sdv 046) via the icss; the diesel discharge was observed to cease. the cro immediately notified the on-shift prod supervisor and oim. at the time of the incident a special task permit 04072 was live for commissioning/test running the diesel transfer system, the work party were immediately contacted by the production supervisor and the permit was suspended. early calculations based on the pu diesel pedestal storage level trend would suggest that approx. 0.8m3 of diesel has been released to sea 1. work activity stopped and diesel release immediately contained. 2. immediate investigation into release cause and pumps/coalescer isolated started by engie 3. av oim’s, coastguard/decc/cygnus sentinel/e80 and nao power (supply vessel) contacted to inform them of the situation. 4. pon1 submitted to decc with initial calculation of diesel spill size 5. witness statements recorded and investigation terms of reference being prepared by engie",ORGP
hand or arm injury,"compressed or pinched by shifting objects or equipment on 6/14/2018, an employee was placing trash/debris in a dumpster when the lid/door closed on and crushed his finger, resulting in a partial fingertip amputation.",OSHA
hand or arm injury,"caught in running equipment or machinery during maintenance, cleaning  on april 21, 2018, an employee was troubleshooting a press when it amputated the employee's left middle finger.",OSHA
"general injury, hand or arm injury, slips & trips","fall through surface or existing opening, unspecified on or about february 12, 2016, an employee was making a cut to a roof membrane. the hvac unit hole was uncovered to fit the material around the hole, and the employee fell into the hole through the roof. the employee was hospitalized with right elbow and hip injuries.",OSHA
foot or leg injury,"caught between rolling powered vehicle and other object an employee was backing into an aisle with a motorized power jack when he lost balance and stepped off the jack. his right foot was then pinched between the power jack and a rack, requiring overnight hospitalization.",OSHA
*** Not Classified,nonclassifiable an employee was pulling an order using a forklift and got his foot caught between the rack and forklift.,OSHA
hand or arm injury,"caught in running equipment or machinery during maintenance, cleaning  an employee was repairing a broken chain on a machine on a repair line when the machine was activated while his hand was on the chain, resulting in a left little finger amputation and broken left ring and middle fingers.",OSHA
"vehicle incident general, dropped object or material, general injury, lifting or moving loads","struck by object falling from vehicle or machinery-other than vehicle part an employee was pulling rods from a well and placing them in a basket on a truck. a rod fell from the basket and struck him on the shoulder. he suffered a collapsed lung and broken bones in the shoulder, and was hospitalized.",OSHA
"general injury, slips & trips","fall on same level due to tripping over an object  an employee was working in the office when they stepped back, tripped over a bag that was on the floor, and fell. the employee sustained a dislocated hip requiring hospitalization.",OSHA
hand or arm injury,caught in running equipment or machinery during regular operation an employee was feeding plastic into a sealing machine and amputated the right middle and ring fingers.,OSHA
"fall from or working at height issue, general injury, hand or arm injury","other fall to lower level 6 to 10 feet an employee was trying to attach a hose to a fire hydrant to fill up a brush truck water tank. the force of the water through the hose knocked the employee off balance. he fell off the brush truck, landing about 6-7 feet below and suffering a broken left elbow.",OSHA
"general injury, hand or arm injury, slips & trips, foot or leg injury","other fall to lower level less than 6 feet an employee was on a 10-foot ladder hanging and removing signs from the front of a building. while coming down the ladder, he slipped and lost his footing, falling from about the halfway point on the ladder to the ground. he landed on his left back side, injuring his back, neck, left knee, and left elbow.",OSHA
electric shock or issue,"direct exposure to electricity, unspecified an employee was working on a roof, removing damaged panels. an electrical shock burned the employee's right hand and right foot.",OSHA
*** Not Classified,"struck by object or equipment dropped by injured worker an employee was removing a 55-gallon barrel from one pallet to another when the pallet broke. the employee lost balance and dropped the barrel, which struck the employee. the employee suffered bruising and was hospitalized.",OSHA
"burns, general injury, fire","vehicle or machinery fire an employee was starting a plastic extruding machine when the die area caught fire, causing third degree burns to the employee's neck, nose, and ears.",OSHA
hand or arm injury,"struck by or caught in swinging door or gate an employee was attempting to open up a broken garage door when his right pinky was caught between two panels of the garage door. his pinky was sliced open and broke, requiring hospitalization and surgery.",OSHA
head or face injury,injured by slipping or swinging object held by injured worker an employee was cutting a ductile water line pipe to be replaced using a gas powered cut off saw. something caused the saw to kick upwards and the body of the saw struck the employee's face causing fractures and a laceration. the employee was hospitalized.,OSHA
hand or arm injury,struck against moving part of machinery or equipment an employee was operating a table saw and amputated the left index finger while moving material away from the blade.,OSHA
"fall from or working at height issue, general injury, slips & trips",other fall to lower level 11 to 15 feet  an employee slipped on a piece of tape and fell approximately 11 feet from the roof resulting in two broken ribs and a fractured scapula.,OSHA
hand or arm injury,caught in running equipment or machinery during regular operation an employee's left little finger was caught and lacerated in a cutting machine.,OSHA
back injury,overexertion in lifting-single episode an employee was delivering construction material. he suffered a back strain while reaching to lift a piece of material.,OSHA
"vehicle incident general, dropped object or material, lifting or moving loads, foot or leg injury","struck by object falling from vehicle or machinery-other than vehicle part an employee was using a paint brush to touch the side of a spool that another employee was loading onto a trailer using an overhead crane when the spool (12 feet long with a 12-inch diameter) caught another spool on the trailer. this caused the other spool, to fall off the trailer and strike the employee's left foot, fracturing it.",OSHA
"back injury, lifting or moving loads","struck against stationary object or equipment, n.e.c. an employee was running new overhead powerlines from a lift when the lift's bucket contacted a pole insulator and moved unexpectedly, throwing him against the side of the bucket and the pole insulator. he strained a back ligament and was hospitalized.",OSHA
