category,text,dset
"foot or leg injury, lifting or moving loads","struck by powered vehicle-nontransport, unspecified employees were loading a skid steer when the operator of the machine lost control and jumped clear from the operator's station. the injured employee attempted to get to the controls to stop the machine when he suffered lacerations and a fracture to his right foot.",OSHA
hand or arm injury,"caught in running equipment or machinery during maintenance, cleaning  an employee was conducting maintenance repair on a conveyor system that transports product throughout the distribution facility. the employee's right ring fingertip was amputated when he attempted to remove a chain from a motor sprocket that drove the conveyor system.",OSHA
foot or leg injury,"caught between rolling powered vehicle and other object an employee was stepping off a stand-up forklift in the battery charging area in order to charge the lift. the lift moved as the employee stepped off, and it pinched his right ankle between the lift and a metal cart. the employee was hospitalized for a broken right ankle that required surgery.",OSHA
hand or arm injury,"caught in or compressed by equipment or objects, unspecified an employee suffered a right index fingertip amputation while repairing a crimping machine.",OSHA
hand or arm injury,"contact with objects and equipment, unspecified employee was helping to move equipment using a front end loader. his finger was amputated by the open pin of the front end loader.",OSHA
hand or arm injury,compressed or pinched by shifting objects or equipment an employee was using a hoist to change a mold. the hoist pivoted and the employee's finger was caught in a pinch point in the hoist. the left middle fingertip was crushed.,OSHA
"foot or leg injury, general injury, hand or arm injury, slips & trips","fall on same level due to tripping over an object  an employee was walking in a hallway at the clinic when she attempted to step around an electrician's box and her foot was caught on the side. she lost her footing and fell to the floor, landing on and fracturing her right elbow. she was hospitalized and had surgery.",OSHA
*** Not Classified,"explosion, unspecified an employee was hospitalized for burns to his body from the chest up from an arc blast.",OSHA
"fall from or working at height issue, head or face injury, slips & trips","other fall to lower level, unspecified an employee was trying to close a trailer door when they fell off the back of the trailer to the ground below, resulting in a head injury.",OSHA
"general injury, fall from or working at height issue","other fall to lower level, unspecified an employee was unloading material from a flatbed truck and fell from a ladder resulting in three broken ribs and a punctured lung.",OSHA
"burns, fire","collapsing building, structure, or structural element during fire two employees received burns to their arms, hands and face while working in the shop area when the facility caught fire.",OSHA
hazardous materials or work,inhalation of harmful substance-single episode an employee was working in a naval submarine simulator and was exposed to epoxy vapors and had trouble breathing.,OSHA
*** Not Classified,"exposure through intact skin, eyes, or other exposed tissue an employee was opening a hatch to check liquid sulfur draining into a pit. the liquid sulfur splashed onto the employee's hand and face, causing chemical burns.",OSHA
slips & trips,"fall on same level due to tripping over an object  the employee was working in the bakery pulling a stock cart when the cart caught her in the heel and knocked her shoe off.  the employee tripped over the shoe, causing her to fall on her left hip.",OSHA
hand or arm injury,"injury by other person-unintentional or intent unknown, n.e.c. an employee was out on a playground with students when one ran into her and knocked her down. she broke her right arm and required hospitalization and surgery.",OSHA
*** Not Classified,"struck by swinging part of powered vehicle an employee was waiting for an excavator to move its boom into place and stop operating. the excavator stopped, and the employee walked toward the machine. the bucket began to move again and struck the employee, causing a spleen injury.",OSHA
*** Not Classified,"multiple types of overexertion involving outside sources an employee experienced chest pains throughout the day while making deliveries to customers. the employee was lifting stock, unloading stock, and setting up ramps at customer locations. the employee was hospitalized with chest pain and heart arrhythmia.",OSHA
hand or arm injury,"caught in running equipment or machinery during maintenance, cleaning  a garbage truck driver had noticed that the hydraulic oil level for the truck's packer blade was low. he was adding oil to the reservoir when the blade retracted and crushed his right hand against the truck body. he suffered two broken wrist bones.",OSHA
hand or arm injury,"caught in running equipment or machinery during maintenance, cleaning  a temporary employee was attempting to clear a jam on a cross cut saw when the saw amputated three fingers.",OSHA
"foot or leg injury, hand or arm injury","struck by discharged object or substance an employee was climbing a ladder with a nail gun hanging off a tool belt when the nail gun trigger hit the ladder, resulting in a nail penetrating the employee's knee. the employee was hospitalized.",OSHA
hand or arm injury,"struck against moving part of machinery or equipment an employee was using a band saw to cut meat when his hand came into contact with the saw blade, amputating his left thumb tip.",OSHA
hand or arm injury,caught in running equipment or machinery during regular operation an employee was using a shear to cut a piece of sheet metal. the employee's finger was pinched under the shear's hold-down; the tip was amputated.,OSHA
"hand or arm injury, slips & trips","caught in running equipment or machinery during maintenance, cleaning  an employee was cleaning out a dust collection system. the employee's flashlight fell into a chute leading to an auger system; as the employee was retrieving it, the rotating auger amputated his lower right arm.",OSHA
hand or arm injury,compressed or pinched by shifting objects or equipment an employee suffered two fingertip amputations when they were caught in a machine's belt and pulley during an inspection. the machine was loto at the time.,OSHA
"back injury, general injury, fall from or working at height issue, slips & trips",other fall to lower level less than 6 feet while moving a dust vacuum an employee tripped over the vacuum's cord and fell 3.5 feet. the employee sustained pain in their back and shoulder.,OSHA
foot or leg injury,"struck by or caught in swinging door or gate employee received a broken right tibia when he entered a belly dump trailer to remove coal ash that was stuck to the inside walls. the dump gates lost power, causing them to close on the employee's leg.",OSHA
general injury,"struck by object or equipment, unspecified an employee was feeding a chipper machine when a board slab shifted, hitting him and knocking him to the floor. he suffered contusions to the right shoulder and hip.",OSHA
"hand or arm injury, slips & trips","caught in running equipment or machinery during maintenance, cleaning  on june 11, 2020, at 7:30 a.m., an employee was diagnosing why a breaker kept tripping on a dust extraction system at a grain dryer facility. as the employee was cleaning out the dust near the airlocks, the system started. the fan blades then amputated all four of his fingers on his right hand.",OSHA
*** Not Classified,"struck by dislodged flying object, particle an employee was walking along a platform when a drill bit, being used nearby, broke and sent a steel shard into the employee's left eye. the employee suffered a cut retina.",OSHA
"foot or leg injury, general illness or health issue","climbing or stepping up or down-single episode an employee was walking toward his truck. when he stepped down to the ground from the sidewalk with his right leg, he felt a pop. he fell to his knees and could not stand up, experiencing tingling and loss of feeling in both legs. he suffered a serious muscle strain to both quadriceps.",OSHA
"foot or leg injury, back injury","fall from collapsing structure or equipment, unspecified employees were decommissioning a tower. the tower collapsed while two employees were on it. one employee was hospitalized for a fractured pelvis and legs.",OSHA
hand or arm injury,"compressed or pinched by shifting objects or equipment as he was tightening a bolt on a piece of equipment, an employee's left hand was caught and fractured between a piece of metal slat and a sprocket.",OSHA
*** Not Classified,"ignition of vapors, gases, or liquids employee in the machine shop received second degree burns to the back of his legs after the torch he was using exploded.",OSHA
hand or arm injury,"struck against moving part of machinery or equipment on september 27, 2018, an employee was shoveling corn kernels when his hand hit the side of a conveyor, resulting in a partial fingertip amputation.",OSHA
back injury,"struck by powered vehicle-nontransport, unspecified an employee had put his truck in park, exited it, and was walking toward a house when he noticed the truck starting to roll toward the house. he ran between the house and the truck to keep the truck from rolling into the house, suffering a broken pelvis.",OSHA
hydraulic fluid or oil leak,"ignition of vapors, gases, or liquids on august 6, 2018, at approximately 12:16 pm, a hydraulic line located at the 3,000-ton press shear station unexpectedly released pressurized hydraulic fluid. the hydraulic fluid traversed to a separate operation next to the press and landed on a hot part (small ring expander), resulting in a flash fire. as a result, two employee suffered second and third degree burns to their hands and face, requiring hospitalization.",OSHA
"dropped object or material, foot or leg injury, lifting or moving loads, vehicle incident general","struck by object falling from vehicle or machinery-other than vehicle part an employee was unloading a steel plate from a trailer at the dock when the steel plate fell from the forklift forks onto his right foot, breaking three bones.",OSHA
"dropped object or material, lifting or moving loads, hand or arm injury","struck by falling object or equipment, n.e.c. an employee was working at a drum dump station, dumping material into a tumbler.  he was putting a 55-pound steel drum onto the dump station when the drum fell. when he tried catching the drum, his right index finger was caught between the falling drum and the next drum in line to be dumped, amputating his fingertip.",OSHA
hand or arm injury,"compressed or pinched by shifting objects or equipment an employee was pulling an engine block out of a wash tank by hand when the employee's left thumb was caught between the engine block and a non-powered roller, resulting in an amputation.",OSHA
*** Not Classified,caught in running equipment or machinery during regular operation an employee was bending metal to make air ducts and the machine caught the employee's hair.,OSHA
hand or arm injury,"caught in running equipment or machinery during regular operation on or about september 2, 2015, at 5:45 a.m., a general bakery employee's left thumb was amputated after it was caught between a rake tool and the side of the mixing tank.",OSHA
hand or arm injury,injured by slipping or swinging object held by injured worker employee was using a 10 lb. sledge hammer to tighten a hammer union.  the employee missed and caught his right index finger between the handle of the hammer and a valve handle.,OSHA
"hand or arm injury, fall from or working at height issue","other fall to lower level, unspecified an employee was standing on a ladder placing boxes on a storage shelf. the employee fell off the ladder and broke the left wrist.",OSHA
"general injury, hand or arm injury, slips & trips","fall on same level due to tripping over an object  an employee was attempting to re-spool electrical wire onto a drum when he tripped over the wire and hit the ground, fracturing his ribs, right index finger, and left elbow.",OSHA
"foot or leg injury, slips & trips",fall on same level due to slipping  an employee was re-setting the car wash and slipped and fell fracturing a knee.,OSHA
hand or arm injury,other fall to lower level less than 6 feet a temporary employee was working on a scaffold approximately three feet above the ground when he fell off the side and broke his the radius and ulna on the right arm and the radius on the left arm.,OSHA
*** Not Classified,"collision between a moving and standing vehicle, nonroadway an employee and a contractor were using a scissor lift to reach the top of the black powder spray booth where steel tanks are brought in to be painted. the employee was going to clean the top of the booth, while the contractor was going to work on the lighting in the area above the booth. the product-carrier which brings the steel tanks to the paint booth was not locked out. the product-carrier started to bring a steel tank to the spray booth and made contact with the scissor-lift. the carrier tipped the scissor-lift over. the employees were thrown roughly six feet when the scissor-lift impacted the ground.",OSHA
burns,"contact with hot objects or substances a maintenance technician was troubleshooting a heat transfer fluid (htf) motor failure on the production line. while the motor was being removed, the technician was sprayed with hot htf, resulting in burns to the hands, arms, and torso.",OSHA
hand or arm injury,"struck by dislodged flying object, particle an employee was operating a draw bench when the tube broke, causing it to recoil into and partially amputate the employee's finger.",OSHA
"dropped object or material, hand or arm injury","struck by falling object or equipment, n.e.c. an employee was working on a cutting machine that did not have the blade engaged.  he hit the lever that controls the up and down motion of the machine. gravity pulled the machine down, and the blade struck his left hand.",OSHA
hand or arm injury,"caught in running equipment or machinery during regular operation 1. on 11/1/15, an employee was changing the reel of paper and caught the left middle finger in a nip point. the finger was amputated to the first knuckle.


2. on 11/11/15, an employee received chemical and thermal burns to the right hand and knee from caustic hydrogen peroxide due to an unclosed valve on the pulp mill equipment. 

note to user: this record contains two separate events that were reported simultaneously to osha by the employer.  these events are captured as one report.",OSHA
hand or arm injury,"struck against moving part of machinery or equipment an employee was cutting pork loins with a band saw when the blade cut his right index finger, resulting in a partial amputation.",OSHA
"back injury, fall from or working at height issue","fall to lower level, unspecified an employee fell approximately 10 feet and suffered broken vertebrae.",OSHA
vehicle incident general,"moving in opposite directions, oncoming, nonroadway on 2-2-2015 at about 8:30 a.m., the injured employee was driving a baggage tractor, towing four empty dollies. a forklift was being driven forward with cargo; the operator could not see the travel path and collided with the tractor.  the injured employee experienced internal injuries to the stomach from impact with the tractor wheel. the employee was taken to the hospital and is in stable condition.",OSHA
slips & trips,"fall on same level, n.e.c.  an employee was walking near a machine that was in operation when he noticed a loose wire on a large reel as the reel was rotating. the employee was caught by the loose wire causing the reel to flip the employee over and onto the ground resulting in a concussion and whiplash to his body and neck.",OSHA
