category,text,dset
"general injury, fall from or working at height issue, slips & trips","other fall to lower level, unspecified an employee was arranging pipe on the trailer. when he went to get down from the trailer the employee slipped on an oily surface and lost his footing. he fell off the trailer and landed on his right side fracturing his hip.",OSHA
hand or arm injury,caught in running equipment or machinery during regular operation an employee was lowering a scissor lift with the remote control. his left thumb got pinched in the lift resulting in a fingertip amputation.,OSHA
*** Not Classified,"exposure to harmful substances or environments, unspecified an employee's socks became wet while pressing on sand bags, which caused extreme blistering and skin around the area to turn black, resulting in a right toe amputation.",OSHA
fire,"ignition of clothing from controlled heat source on may 5, 2017, an employee was using a cutting torch to dismantle equipment when the employee's shirt caught on fire. the employee suffered first and second degree burns to the abdomen and was hospitalized.",OSHA
"back injury, hand or arm injury, fall from or working at height issue","other fall to lower level less than 6 feet an employee was stepping off the bottom rung of a step ladder, lost balance and fell. the employee sustained a broken pelvis and a broken left wrist.",OSHA
*** Not Classified,"exposure to harmful substance through skin, eyes, or other exposed tissue, unspecified an employee was hospitalized with cellulitis after repeatedly handling 30-pound furnace rollers.",OSHA
"hand or arm injury, slips & trips",struck against moving part of machinery or equipment an employee was pushing a board through a shaper when the employee's hand slipped and went into the blade. the employee suffered an amputation of the right-hand middle finger to the first knuckle.,OSHA
*** Not Classified,exposure to environmental heat an employee became dehydrated and had to be hospitalized.,OSHA
"foot or leg injury, slips & trips","fall from collapsing structure or equipment, unspecified an employee was loading a tractor trailer from a ladder when the ladder buckled. the employee then fell to the macadam, fracturing bones in the right leg and/or ankle and requiring hospitalization.",OSHA
"general injury, slips & trips","fall on same level, n.e.c.  an employee lost her footing and fell fracturing the right hip.",OSHA
hand or arm injury,compressed or pinched by shifting objects or equipment an employee was loading equipment onto a trailer when the employee's thumb was pinched and lacerated between the equipment's roller and articulating plate.,OSHA
"electric shock or issue, fall from or working at height issue","other fall to lower level less than 6 feet on 04/19/2016, at about 5:00 p.m., an employee was installing new lights on wires when a coworker turned on the breaker. the employee received an electric shock and fell 4 feet off the ladder. he was hospitalized overnight with second-degree electrical burns to one of his hands.",OSHA
"dropped object or material, foot or leg injury, slips & trips","struck by falling object or equipment, unspecified an employee was unbolting an i-beam when it fell on his right foot, resulting in the amputation of four toes.",OSHA
hand or arm injury,"compressed or pinched by shifting objects or equipment an employee was moving a bundle of pipe when his left hand was caught in the bundle, resulting in a left ring fingertip amputation.",OSHA
hand or arm injury,"caught in running equipment or machinery during maintenance, cleaning  an employee was cleaning a spray dryer, at or near the rotary valve, and amputated fingers on the right hand.",OSHA
hand or arm injury,"compressed or pinched by shifting objects or equipment an employee was manually moving a 55-gallon drum of caulking from a wood pallet to a dolly. the drum slipped back into its original position, pinching his finger against an adjacent drum. the injury resulted in a fingertip amputation.",OSHA
hand or arm injury,"caught in running equipment or machinery during regular operation an employee was moving scraps on an assembly line. she was sitting down beside the conveyor belt with her hand resting on the conveyor belt. the conveyor belt is automatic and turned on. her cotton glove was caught in the belt, resulting in the left index finger getting caught between the chain and the frame. she was hospitalized with a lacerated/broken left index finger.",OSHA
fall from or working at height issue,other fall to lower level 6 to 10 feet an employee stepped off a ladder onto the roof of a home and fell approximately 10 feet.,OSHA
"foot or leg injury, slips & trips","other fall to lower level, unspecified an employee slipped and fell while walking down the stairs, injuring her leg.",OSHA
"general injury, slips & trips","fall on same level due to slipping  an employee slipped on the floor and struck an electrical box while cleaning at the end of his shift. the employee sustained three broken ribs and a collapsed, bleeding lung.",OSHA
"foot or leg injury, lifting or moving loads","pedestrian struck by rail vehicle-transportation incident on or about 1/8/15 at 12:10 a.m., an employee was working between two boxcars located on a private railroad when the cars began to move.  the employee tried to get out from between the cars when one of the cars pinched his left foot, resulting in fractures.",OSHA
"foot or leg injury, hand or arm injury",caught in running equipment or machinery during regular operation an employee was folding the mechanical lift on a bus when his left arm was caught in the lift. he injured two tendons in his left wrist and required hospitalization.,OSHA
*** Not Classified,"exposure to environmental heat an employee was overseeing a natural gas line repair contractor at the intersection of west glen 7 north monroe, ridgewood, new jersey. the employee experienced dizziness and light-headedness and was hospitalized for treatment of dehydration and low sodium.",OSHA
"hand or arm injury, slips & trips","contact with objects and equipment, n.e.c. an employee was standing on the ground reaching over the rear passenger side wheel well directly adjacent to an affixed catwalk on the rear of a water supply truck. while the employee was operating a drain valve located on the rear of the tank, the employee slipped on snow and ice building up on the street surface. as the employee slipped and fell, they grabbed the catwalk guard railing and their left ring finger caught on the railing corner gusset support, resulting in a partial amputation down to the first knuckle.",OSHA
foot or leg injury,"other fall to lower level less than 6 feet an employee fell backwards (5 to 6 feet) off a ladder on 8/14/15, breaking the tibia to the right knee.",OSHA
"foot or leg injury, vehicle incident general",pedestrian struck by forward-moving vehicle in nonroadway area an employee was on a 12-foot step ladder changing a light bulb in the facility. another employee drove his vehicle into the building and bumped the ladder; the injured employee fell off and broke both ankles.,OSHA
"hand or arm injury, slips & trips","fall on same level due to tripping on uneven surface an employee was walking and tripped over the ground elevation difference, fell and broke the upper right arm.",OSHA
"foot or leg injury, slips & trips","caught in running equipment or machinery during regular operation an employee was using a foot to set slips when the right foot was caught between slips and the rig floor, resulting in a partial amputation of the little toe.",OSHA
"hand or arm injury, slips & trips","fall on same level due to slipping  on march 16, 2021, an employee slipped on black ice (concealed by recent snow) while stepping out of a building. the employee fell, suffering a broken left wrist.",OSHA
"foot or leg injury, fall from or working at height issue","other fall to lower level, unspecified while descending an a-frame ladder, an employee lost his balance and fell. he landed sideways and broke his right ankle, requiring hospitalization.",OSHA
"foot or leg injury, general injury, head or face injury, slips & trips","fall on same level, n.e.c.  an employee was performing a ski cut, an avalanche mitigation technique, when snow underneath his skis gave way causing him to fall head-first downhill. his hip struck a rock when he fell and he suffered a broken femur.",OSHA
"foot or leg injury, general injury, fall from or working at height issue","other fall to lower level, unspecified on november 22, 2019, an employee fell while walking down a flight of stairs, suffering a bruised knee and neck and back injuries. the employee was hospitalized.",OSHA
"back injury, slips & trips","fall on same level due to tripping over an object  an employee was carrying a shelf unit from the carpentry shop across the hall to the paint shop when he tripped on a painter's tripod and fell, resulting in a cracked pelvis on his left side.",OSHA
hand or arm injury,"caught in running equipment or machinery during maintenance, cleaning  an employee was servicing an airlock machine when it amputated his left index, middle, and ring fingertips.",OSHA
back injury,"pedestrian struck by vehicle backing up in nonroadway area an employee was preparing to load a truck. as the truck backed up, it crushed the employee against the loading dock, injuring the employee's back.",OSHA
"general injury, vehicle incident general, dropped object or material, foot or leg injury, general illness or health issue","struck by falling object or equipment, unspecified employees were moving a 500- to 600-pound shaker that was about 6 feet tall and 4 feet in diameter. as the employees were loading the shaker into the bed of a truck, it fell over and struck a temporary employee in the left knee. the employee suffered muscle damage.",OSHA
hand or arm injury,"struck by swinging or slipping object, other than handheld, n.e.c. an employee was removing casing. the casing swung from the rig and struck the employee's right index finger against the rig tongs, smashing the fingertip. the employee was hospitalized.",OSHA
"foot or leg injury, hand or arm injury","injured by object breaking in hand  an employee was grinding down a casting when the grinding wheel exploded, striking and cutting his left leg. he fell backward and broke his tibia in two places. he was hospitalized, undergoing surgery.",OSHA
head or face injury,"injured by slipping or swinging object held by injured worker on 7/9/15, an employee broke a bone in his face when the string trimmer he was using hit him in the face while he attempted to adjust the string.",OSHA
foot or leg injury,struck by swinging part of powered vehicle an employee was closing a semi-truck trailer door when the cable to the door broke; the trailer door slammed onto his foot.,OSHA
foot or leg injury,"struck by object or equipment, unspecified while deconstructing a locomotive engine, an employee was struck by a piece of engine, which broke the employee's leg.",OSHA
