category,text,dset
back injury,"employee feels strain in upper back while moving a valve. migrated from legacy cairs incident #38297material handling, while re-locating a 4in 300 series ball valve from one pallet to another the employee stated that he felt a back strain. axiom medical was contacted advising the employee of first aid measures. migrated from legacy cairs - see detailed description",ORGP
"slips & trips, dropped object or material","employee was descending  a stairwell from the mezzanine deck to the production deck.  when he was on the fourth step , the employee slip, fell  and slid down the remaining stairwell (approx. 10 steps). migrated from legacy cairs incident #40131on wednesday 21st november at approximately 8:30am a crew of three (3) was scheduled to perform a site visit at bptt cashima’s offshore facility in preparation for an upcoming outage. the team led by the construction supervisor was the first to descend the stairwell from the mezzanine deck to the production deck when the supervisor stepped on the fourth tread, slipped on an unknown oily substance, fell backwards and slid on his back to the bottom of the stairwell (approximately 10 treads down). the injured person (ip) was subsequently medi-moved of the cashima facility and taken to a third-party medical facility for evaluation and treatment. the incident was reported to the client and massy wood management team. migrated from legacy cairs - see detailed description",ORGP
"vehicle incident general, foot or leg injury",wg employee’s vehicle was parked and struck by another vehicle. wg vehicle received damage to the driver and cab door. there were no injuries as a result of this incident. migrated from legacy cairs incident #34631wg employee’s vehicle was parked and struck by another vehicle. wg vehicle received damage to the driver and cab door. there were no injuries as a result of this incident. migrated from legacy cairs - see detailed description,ORGP
*** Not Classified,"utv containing 4 employees tipped over when right front tire contacted unseen culvert in high grassy area as they were attempting to make a u-turn. all 4 employees taken to clinic for evaluation and released back to work with first aid treatment. migrated from legacy cairs incident #39969a wood employee was driving a utv with 3 other passengers west bound on a dirt road. the driver was attempting to make a u-turn in the road (the utv's turn radius did not allow for a complete u-turn on the roadway), so the driver drove slowly onto the shoulder and through waist high grass with low visibility. unbeknownst to the driver, there was a culvert that crossed the road that had approximately 16"" drop off next to the culvert. when the right front tire of the utv contacted the drop off, it caused the weight to shift in the utv which allowed the utv to slowly tip over onto its side. all four employees were wearing their seatbelts at the time of the event. the driver and three passengers where taken to offsite clinic for evaluation where all four were released back to work with first aid treatment. migrated from legacy cairs - see detailed description",ORGP
"lifting or moving loads, vehicle incident general","sea container door was caught by the wind and struck the driver’s side mirror of a parked light vehicle sea container door was caught by the wind and struck the driver’s side mirror of a parked light vehicle incident reported, investigation commenced.",ORGP
*** Not Classified,"ip was on location when a piece of tubing came loose and caused some water and condensate to get into his eyes.  on september 3, 2021 at 9:30 am, ip was on location in kenedy, tx isolating a sight glass opened bleed valve that had 3/8 tubing tied in, which ran to the sump. the tubing came loose at a union and caused some condensate and water to get behind the ip’s safety glasses and into his eyes. ip was taken to the nearest medical clinic, in which they recommended first aid measures. actual (b1): ip was instructed by the clinic to  apply first aid measures to his injury. potential (b2): this could have turned into a medical treatment case with further damage to the ip's eyes.  ip was taken to the nearest clinic for evaluation and first aid. ",ORGP
*** Not Classified,gpa due to indication of sprinkler release in 200 and 300 level accommodation migrated from legacy cairs incident #33967at 03:40 on the 4th of june 2017 the gpa activated due to indication of a sprinkler release in the 200 and 300 levels of the accommodation. all platform personnel were fully mustered in 8 minutes.the ert team lead was instructed to conduct a sweep of these levels to confirm the status.both the 200 and 300 levels were confirmed to be clear with no signs of water discharge.all personnel were then stood down.the instrument department currently have an on-going work scope regarding the accommodation sprinkler system and this is believed to be thecause. migrated from legacy cairs - see detailed description,ORGP
covid,"employee tested positive for covid 19. employee began running a low grade fever on 7/10/20 while on board ei-314. employee was sent in on 7/11/20  with low grade fever and cough for covid testing and received positive results. employee continued with mild symptoms and was sent home for quarantine. client notifications were made and contact tracing performed on facility.  employee was sent in for medical evaluation and upon confirmation of covid, results were communicated with the client and facility for sanitation and contact tracing.",ORGP
"back injury, head or face injury","ip while removing a hatch cover in the compressor room in the aft machinery space with a winch, the winch handle came free of the winching mechanism and struck his safety glasses forcing the glasses back into his face migrated from legacy cairs incident #30851ip while removing a hatch cover in the compressor room in the aft machinery space with a winch, the winch handle came free of the winching mechanism and struck his safety glasses forcing the glasses back into his face and causing a 1.5 cm laceration to the l eyebrow from the glasses hinge.ip reported to the health center and the laceration was treated with first aid measures including steri-strips in consultation with the on call physician. ip returned to work on regular duties at this time migrated from legacy cairs - see detailed description",ORGP
vehicle incident general,employee was operating a forklift when he brushed against a parked car. migrated from legacy cairs incident #28715employee was operating a shore base forklift. employee attempted to pass slowly on side of a parked vehicle to exit the gate when he brushed against the vehicle causing minor damage to the right rear fender. no injuries to report. migrated from legacy cairs - see detailed description,ORGP
covid,"wood team member tested positive for covid-19 while working from home a wood team member experienced mild signs and symptoms associated with covid 19 and was seen and tested by a primary health care provider. the employee received a positive test result.  employee, reported to hssesome recommendations were sent to the employee by hsse",ORGP
lifting or moving loads,"skid steer was traveling with load and tipped forward with the final resting position on the tip of the forks and front of the tracks. on tuesday, september 15, 2021 at approximately 4:40pm, a mechanical worker/operator was in block 4 at pcs 33 traveling west with a secured load of 8 torque tubes with assembly brackets attached. the operator had a spotter on a utv leading the skid steer by approximately 30 feet.  the skid steer tipped forward after a shallow rut in the field implanting the forks which elevated the rear of the equipment.  the operator was wearing their seatbelt and equipment does have rollover protection. the actual severity rating is a1 as the employee received no medical attention. the potential severity rating is b2 as there could have been medical treatment to operator and asset damage to the equipment and material. a forklift was brought to assist with the shifting of the skid steer to a upright/level position to assure the safety of the operator. the employee informed their foreman and general foreman. the scene was frozen. investigation protocols were initiated. the operator was escorted to the safety office, along with spotter, foreman and witnesses for statements.  ua's were performed on operator and spotter. ",ORGP
back injury,lower back pain employee experienced back pain while carrying concrete samples via 8 gallon bucket. employee sought treatment at the onsite first-aid station and contacted workcare.  employee received first-aid treatment and did not require anything additional.,ORGP
"slips & trips, foot or leg injury","employee fell while attempting to remove t-post, no treatment employee was removing “t” post by hand along the west common trench with no issues. he came across one a little deeper than normal and began to push and pull to remove post. the t post broke at the base causing employee to fall forward to hands and knees onto the dirt. employee informed foreman and gf escorted to occucare. employee was assessed, and no treatment required. investigation ongoing.",ORGP
"back injury, foot or leg injury",i.p. climbed a ladder onto scaffold platform when he stood up he felt a twinge in his back migrated from legacy cairs incident #38470i.p. climbed a ladder onto scaffold platform when he stood up he felt a twinge in his back. he reported immediately to the medic where he received first aid i.e. pain killers he rested for 2 hours and returned to work and carried on with his role without effect. migrated from legacy cairs - see detailed description,ORGP
"general illness or health issue, covid",wood employee reported +ve pcr test for covid19 wood engineer reported he had taken a pcr test after feeling unwell which reported as +ve.  close contacts identified and sent for testing from last exposure.,ORGP
*** Not Classified,"crew removed duct from above a platform exposing an existing hole in the grating of the platform approx 10' off the ground. crew did not cover hole in platform or have an attendant in place violating client policy. no fall potential existed. migrated from legacy cairs incident #39897crew was demoing duct from a platform approx. 10' off the ground. removing the 42 inch duct exposed an existing hole (approx 4ft x 2ft) in the grating of the platform that the crew was working on. a spotter was placed to ensure personnel would not enter the area, per client policy. after duct was removed, the site went into lightening alert and the crew left the area. all clear was given, crew progressed to the top level platform to resume demo. as shift change approached, crew left area without covering the hole in the platform or barricading/guarding the hole. no personnel were within 6' of the open hole at any time, no fall potential existed for personnel. situation was corrected by removing the only access to the area to ensure no personnel could access the platform. migrated from legacy cairs - see detailed description",ORGP
*** Not Classified,admin control breach to permit system migrated from legacy cairs incident #40127subcontractor added hot work scope to existing critical work permit without speaking to wood permit issuing officer. wood made aware of this post completion of works. migrated from legacy cairs - see detailed description,ORGP
covid,"wood employee tested positive for covid -19 tested positive lft on the 28th feb 2022,  will monitor over the next week in accommodation isolation at accommodation will test on 6th and 7th day with lft testing ",ORGP
foot or leg injury,"two mechanics working on confined space equipment felt discomfort due to the smell of ammonia. migrated from legacy cairs incident #40001twomechanics working on confined space equipement felt discomfort due to the smellof ammonia.ipwere evacuated to fertial medical clinic , received first aid (intake oxygen)and after were evacuyated to annaba hospital for more medical exam : bloodanalysis .afterconfirmation of their state out of danger ip's were allowed to go home withrest of three days migrated from legacy cairs - see detailed description",ORGP
*** Not Classified,"potential acm detected below grade migrated from legacy cairs incident #36315during excavation within juhi greenfields site, potential acm detected below grade at a depth of 300 mmsize of 300 mm x 300 mm, client notified, area scanned for further exposuressample sent for analysistreated as positive until confirmed migrated from legacy cairs - see detailed description",ORGP
*** Not Classified,"wcc non compliance during routine cold work control certificate 020259 (spray applications of coatings to various platform locations) was subject to a routine issow audit. during the audit it was discovered that the required 'air purity tests' for the air fed breathing apparatus in use had not been completed as per the requirement of the wcc.  work activity was suspended until an air purity test was conducted, at which time it was discovered that the draegar test equipment required to perform the test was not available and had not been available for a period of time leading up to this event. ",ORGP
"general illness or health issue, back injury",worker suffered chest pain while coming back to rest area a worker felt some pain on his chest and difficulty in breathing while walking back to rest area from site. he was then brought to the site clinic by his supervisor. site medic assessed the ip and notified wood management . a decision was made to call for an ambulance for the ip to be assessed further. the personnel was immediately taken to the site medic by his supervisor. site paramedic examined him and called for an ambulance for further evaluation of his condition. paramedics from ambulance performed an ecg test. ip was conveyed to the nearest hospital for further assessment.,ORGP
*** Not Classified,tote of top seal was leaking from a closed valve. rough draft:  after weekend off bay foreman pulled up to job location and noticed a tote of top seal white leaking from bottom valve that was in the closed position. final to follow. bay foreman notified supervisor and safety. wood environmental was notified scene was frozen. investigation ongoing.,ORGP
foot or leg injury,"whislt moving 3 drawer cabinet, drawers opened hitting on of the office support workers foot our office support staff (3 people) were trying to put the 3-drawer mobile onto the cart. when the first try was not successful, one of our support staff forcefully pushed the 3-drawer mobile onto the cart while tilting it. however, since the drawers were not locked, all the drawers suddenly opened hitting the foot of one of our guys. advised work team to put tape on the drawers to prevent them from opening again.",ORGP
foot or leg injury,"sub-contractor found unknown material while carrying out maintenance activities. work was stopped, area cordoned off and material sent for testing.(no injury) migrated from legacy cairs incident #28871· on 23/02/2016, asbestos was identified within two hv cubicles in the winneke main substation, as part of lrc project p6068 hv upgrade site works. specialist asbestos subcontractors were engaged to remove and provide clearance for the two cubicles.· during the asbestos remediation works on the cubicles, the subcontractor identified further fibrous asbestos within the confined space cable tunnel beneath the main substation.· the main substation and cable tunnel were isolated and asbestos testing undertaken.· the main substation was cleaned by asbestos specialists. · pre-clean and post-clean testing in the main substation confirmed no asbestos present. · testing confirmed the material within the cable tunnel was fibrous brown asbestos (amosite).· the cable tunnel and hv cubicles were kept isolated and tagged out until additional remedial works could be arranged.· spirometry testing was arranged for wgpsn project personnel whom had entered the cable tunnel. updates were provided to all subcontractors whom had been involved with the project works.· remedial works were completed to achieve clearance for the hv cubicles. · remedial works were completed to achieve clearance for most of the cable tunnel to allow completion of the p6068 project works.one end of the cable tunnel remains isolated, with the remedial works required to gain clearance scheduled during the next 22kv shutdown (during may2016). migrated from legacy cairs - see detailed description",ORGP
"slips & trips, foot or leg injury","ip tripped, fell and suffered a sore knee. migrated from legacy cairs incident #39644ip was walking along a passageway (5fc0) on board hms prince of wales, when his foot caught on some loose deck protection (twinwall), causing him to trip, stumble and fall on to his right knee. as an outcome the ip suffered a small graze to his right knee.as an immediate corrective action , the twinwall was re-taped to the deck and the incident reported. migrated from legacy cairs - see detailed description",ORGP
lifting or moving loads,middle and index third knucles struck by shifting modules.			 employee was taking controler modules out of the box. he had took three modules out and went to remove another one when the stack shifted over striking his right hand on the index and middle third knuckle area. 			 employee evaluated by site medic and will return tomorrow morning for a follow up evaluation.  investigation team will coach employees in the use of the kick stand so that panels do not shift during the removal process.  			,ORGP
hand or arm injury,"a wood member felt a numb on his right hand. he called his friends who took him to the hospital and medical investigations were carried out. a wood member felt a numbness on his right hand while he was in his accommodation in bahrain during the weekend. he called his friends living in the area who arrived immediately and helped him to go to hospital. medical investigations were carried out however no specific issue was identified. medicines were provided and the ip was discharged. while in the ip was in the hospital, a wood member living nearby was informed, he visited the ip and reported the incident to wood hse and operations directors. the ip was taken to hospital, medical investigation was carried out, medicine was provided and the ip discharged. each of wood operations director, project director and hsse director contacted the ip and advised him to consult with the doctor prior to do any activity such as driving or travel and to contact if he needs any further assistance. the operations director and project director are living in bahrain and are keeping contact with the ip to provide assistance as needed. ",ORGP
lifting or moving loads,"struck by swinging or slipping object, other than handheld, n.e.c. an employee was installing 2x4 light fixtures into a ceiling grid. he measured how much tie wire he would need to secure the fixtures' catty corner onto the ceiling grid. he realized he would need a taller ladder so he started coming down and decided to cut the wire he had measured out. the wire spool was sitting on top of the ladder he was using. when he cut the wire, the end sprang upwards and went between the bottom of his safety glasses and his face, puncturing his right eye.",OSHA
"fall from or working at height issue, hand or arm injury, foot or leg injury","other fall to lower level, unspecified an employee was working with a crew on a roof to remove the existing concrete tile and underlayment. he walked down to the eave of the roof with his rope to install the new underlayment. while installing the underlayment, he slipped off of the roof onto the concrete porch below, fracturing his arm and leg.",OSHA
hand or arm injury,"compressed or pinched by shifting objects or equipment on march 20, 2020, an employee was hooking a coil of metal to put in a dip tank when his finger was pinched between the coil and the hook, resulting in a left middle fingertip amputation.",OSHA
slips & trips,"struck against moving part of machinery or equipment an employee tripped while climbing back into a work station. the employee's hand entered the gap in a saw blade's guarding, and the blade severed the top of the employee's ring finger.",OSHA
slips & trips,"fall on same level due to slipping  an employee was performing janitorial services in a bathroom when she slipped and fell, breaking her clavicle.",OSHA
hand or arm injury,"caught in running equipment or machinery during maintenance, cleaning  an employee was performing maintenance on a plastic grinding machine. as he was attempting to dislodge a plastic piece in the machine, his left ring finger was caught between a belt and pulley, amputating the fingertip.",OSHA
hand or arm injury,caught in running equipment or machinery during regular operation an employee was using a coping grinder to grind a piece of flat bar. the flat bar gave way and the employee's hand was caught in the machine amputating the left little finger to the second knuckle.,OSHA
"slips & trips, foot or leg injury",other fall to lower level less than 6 feet an employee was on a stool retrieving a book. the employee lost balance and fell to the floor fracturing a femur.,OSHA
"hand or arm injury, bites (animals or insects)",stings and venomous bites an employee was hospitalized after suffering a bee/wasp sting while conducting a maintenance walk around. the sting on the left arm developed into acute compartment syndrome.,OSHA
"slips & trips, fall from or working at height issue, general injury, hand or arm injury, foot or leg injury","other fall to lower level 21 to 25 feet  an employee was on the roof of a building installing his anchor point to hook up his personal fall protection when he slipped on an ice patch and fell 21 feet to the ground below. he broke both wrists, both arms, his left leg, and his left hip, requiring hospitalization.",OSHA
*** Not Classified,"exposure to traumatic or stressful event, n.e.c.  an employee had just finished her shift and clocked out. as she was leaving the hospital, a women approached her with a baby that was not breathing. the employee began cpr and then carried the baby to the er department. after the incident, the employee reported being short of breath and was later hospitalized, suffering from an aggravation of a neuromuscular disease.",OSHA
hand or arm injury,compressed or pinched by shifting objects or equipment a temporary employee was writing on a large roll of paper when a forklift driver pushed another roll against the roll she was writing on and her left forearm became lodged and fractured between the rolls.,OSHA
hand or arm injury,"caught in running equipment or machinery during regular operation an employee was operating a grooving machine when his glove was caught in the machine and his right hand was pulled in, amputating his little finger. the machine was unguarded at the time.",OSHA
general illness or health issue,"multiple types of overexertion involving outside sources an employee was shoveling snow, went on a break and collapsed from a possible heart attack after returning from the break.",OSHA
"slips & trips, fall from or working at height issue, general injury","other fall to lower level, unspecified an employee was walking down stairs when he lost balance, fell, and broke his collarbone.",OSHA
*** Not Classified,"exposure through intact skin, eyes, or other exposed tissue an employee was using an acidic solution to clean an indoor car wash when he received chemical burns to his right hand, requiring hospitalization.",OSHA
"fall from or working at height issue, hand or arm injury",other fall to lower level 6 to 10 feet an employee was working from a ladder replacing a tank liner when the ladder slid out from underneath causing the employee to fall 10 feet. the employee sustained a broken wrist and thumb.,OSHA
hand or arm injury,caught in running equipment or machinery during regular operation an employee was feeding boards into a door jamb machine when his left hand was caught and crushed in the machine's chain and sprocket. he was hospitalized.,OSHA
"slips & trips, dropped object or material, back injury","struck by falling object or equipment, unspecified an employee was sweeping the floor when a bale of cotton fell on him, injuring his lower back.",OSHA
"fall from or working at height issue, general injury, hand or arm injury",other fall to lower level less than 6 feet an employee was descending a ladder when it slid. it and the employee fell about 4 feet to the ground; the employee suffered a broken elbow.,OSHA
"slips & trips, lifting or moving loads, dropped object or material, vehicle incident general","struck by object falling from vehicle or machinery-other than vehicle part an employee was guiding a 1500-pound weight that was being carried by a forklift to the wheel on a tractor. the weight slipped off and fell on the employee's left lower leg, requiring hospitalization.",OSHA
"slips & trips, general injury","fall on same level due to tripping, unspecified an employee was walking between golf carts in the cart barn when he tripped and fell fracturing his left hip.",OSHA
"slips & trips, dropped object or material, lifting or moving loads","struck by falling object or equipment, n.e.c. an employee was offloading sliding glass doors. after removing a strap, the employee was walking away and the doors fell on him. the employee was hospitalized with a cervical fracture.",OSHA
"slips & trips, foot or leg injury",fall on same level due to slipping  an employee walking down a plywood ramp that was slick from the rain slipped and fell breaking his leg.,OSHA
