category,text,dset
hand or arm injury,"caught in running equipment or machinery during regular operation an employee was operating a screw conveyor when his left hand entered the conveyor's auger, resulting in an amputation of approximately 3/4 of the middle finger.",OSHA
"fall from or working at height issue, head or face injury, general injury, foot or leg injury","other fall to lower level 21 to 25 feet  an employee was washing down brick from a scaffold when the employee fell approximately 25 feet from the scaffold to the ground/wall. the employee was hospitalized with a broken leg, broken hip, and broken nose.",OSHA
"fall from or working at height issue, electric shock or issue, foot or leg injury",other fall to lower level less than 6 feet an employee was working on a 6' ladder installing a light fixture. the employee received an electrical shock and fell from the ladder fracturing his foot.,OSHA
foot or leg injury,"struck or run over by rolling powered vehicle an employee was operating an electric pallet jack to move product in the warehouse. during the process, he stepped off the pallet jack and it struck his left foot, causing a laceration and fracture.",OSHA
"fall from or working at height issue, general injury, hand or arm injury, slips & trips","other fall to lower level, unspecified while using a dolly to deliver a package to a home owner, an employee fell out of the back of the delivery truck and onto the roadway, breaking three ribs and an elbow.",OSHA
burns,"contact with hot objects or substances an employee was repairing a condensate line union when hot water burned his chest, abdomen, and left arm.",OSHA
foot or leg injury,"entangled in other object or equipment while exiting a loader that was missing a step, an employee lost balance and got his right leg tangled in the netting resulting in a fracture of the right leg.",OSHA
"fall from or working at height issue, general injury","other fall to lower level 6 to 10 feet an employee was struck by a 10' x 10' section of wood framing while he was descending from a ladder. he fell 6 feet to the ground. while he was on the ground, the section of framing fell on top of him, breaking his collarbone, two left-side ribs, and two right-side ribs.",OSHA
*** Not Classified,nonclassifiable an employee working in the kitchen suffered an amputation.,OSHA
hand or arm injury,compressed or pinched by shifting objects or equipment an employee was connecting a dolly to a trailer. the dolly rolled forward and the employee's hand was caught between the pintle hook and metal plate of the trailer resulting in crushed and broken left pinky and ring fingers.,OSHA
"dropped object or material, back injury, general injury","struck by falling object or equipment, n.e.c. an employee was trimming an overhead limb off a felled tree when the tree branch fell and struck the employee. the employee suffered three fractured ribs, a collapsed lung, and a t-12 vertebrae fracture.",OSHA
"slips & trips, foot or leg injury","fall onto or against object on same level, n.e.c. an employee was running from a dog while delivering a package when the employee leapt or fell into a vehicle, suffering back and knee injuries. the employee suffered a cut to the knee that required surgery.",OSHA
"general injury, slips & trips","fall on same level, n.e.c.  an employee was lifting a bag off a belt in the bag room. the employee fell to the ground due to the weight of the bag and sustained a hip fracture.",OSHA
"lifting or moving loads, foot or leg injury","struck by object or equipment, unspecified an employee was hooking up an air line on a piece of equipment. a crane load struck the employee, who suffered multiple leg fractures.",OSHA
foot or leg injury,"part of occupantís body caught between vehicle and other object in nonroadway transport incident an employee was in training, operating a stand-up pallet lift, when his left foot was caught in the designated pathway railings. the employee sustained torn muscles and ligaments.",OSHA
"fall from or working at height issue, back injury, general injury","other fall to lower level, unspecified an employee was placing a ladder against the main building to tie it off. as he climbed the ladder, he reached out with his right hand and grabbed the energized metal gutter on a drive-under canopy next to the main building and was shocked. this caused him to fall off the ladder, dislocating/breaking his right shoulder, and cracking his right shoulder blade and vertebrae. he was hospitalized.",OSHA
"vehicle incident general, hand or arm injury","compressed or pinched by shifting objects or equipment on october 22, 2016, an employee was pushing a stick cart. the employee had his left hand on top of the stick cart when he hit another stick cart. the wooden sticks came towards his hand amputating the distal part of his left middle finger.",OSHA
hand or arm injury,"caught in running equipment or machinery during maintenance, cleaning  an employee was responding to a quality issue with a piece of equipment that had a fixture out of place. the clamp was under pressure with air and continued to move once the fixture was back in place. the clamp then pinched the employee's left middle finger and tore off the nail and fingertip.",OSHA
"vehicle incident general, lifting or moving loads, foot or leg injury","pedestrian struck by vehicle backing up in nonroadway area a forklift backed into an employee, running over his right foot and leg. the employee suffered a leg fracture.",OSHA
hand or arm injury,"compressed or pinched by shifting objects or equipment an employee was kneeling on the floor and raising a hoist with a roller, using the pendant to change a roller at the bottom of a press. the employee's left hand was on top of the hoist rail when he raised the hoist using a pendant, and his left pinky finger was pinched between the hoist rail and the machine's frame, amputating the fingertip.",OSHA
*** Not Classified,"contact with hot objects or substances an employee was loading chicken feathers into a bin. rendering fluid splashed on him, causing third-degree burns over 40 percent of his body.",OSHA
"fall from or working at height issue, general injury","other fall to lower level, unspecified maintenance employee suffered a hip injury from a fall to a lower level when he fell off a ladder.",OSHA
eye injury or irritation,"direct exposure to electricity, greater than 220 volts an employee was installing a 24v dc transformer inside a control panel with 480v wires.  during this process,  an arc flash occurred that caused second degree burns to the employee's hands and face.  the employee was hospitalized.",OSHA
foot or leg injury,"nonroadway incident involving motorized land vehicle, unspecified an employee was operating a forklift when it crushed his left foot.",OSHA
"vehicle incident general, foot or leg injury","nonroadway incident involving motorized land vehicle, unspecified an employee was involved in a golf cart accident resulting in a broken ankle.",OSHA
"slips & trips, foot or leg injury",fall on same level due to tripping over an object  an employee was standing at the box making machine's manual conveyor. the employee's foot got caught on the fixed leg of the conveyor. the employee's knee then buckled and she fell. the employee was hospitalized with a fractured right patella and a fractured left humerus.,OSHA
hand or arm injury,"caught in running equipment or machinery during maintenance, cleaning  the employee was tightening a belt on the wood chipper. after the repair, the employee turned the machine off. while the machine was coasting to a stop the employee got his left hand caught between the belt and pulley of the wood chipper, resulting in the amputation of two fingers.",OSHA
"fall from or working at height issue, slips & trips, foot or leg injury",other fall to lower level 6 to 10 feet an employee lost his footing while climbing down a ladder and fell approximately eight feet to the concrete ground fracturing the left leg.,OSHA
*** Not Classified,"fall from collapsing structure or equipment 21 to 25 feet  two employees were working on a scaffold when the scaffold's saddle hanger broke, causing them to fall approximately 24 feet to the concrete below. they were hospitalized.",OSHA
"general injury, slips & trips",fall on same level due to tripping over an object  an employee was cleaning and restacking 2-liter bottles when the employee's foot became tangled in shrink wrap. the employee fell onto the concrete floor and suffered a hip fracture.,OSHA
"vehicle incident general, back injury",pedestrian struck by vehicle backing up in nonroadway area an employee was walking behind a vehicle when it reversed and crushed the employee between it and a second vehicle. the employee suffered a fractured pelvis and was hospitalized.,OSHA
"general injury, foot or leg injury","pedestrian struck by vehicle in nonroadway area, unspecified an employee was working near the steel loader rake unit. the unit slipped and rolled over the employee breaking his right foot and three ribs.",OSHA
"general illness or health issue, hazardous materials or work",inhalation of harmful substance-single episode an employee had an allergic reaction to a bleach-based cleaning compound. the employee was hospitalized for respiratory distress.,OSHA
"dropped object or material, slips & trips, foot or leg injury","struck by falling object or equipment, unspecified on november 30, 2017, an employee attached a plate clamp to the side of a 5x10 piece of sheet metal that was 0.5 inch thick. the plate clamp was connected to an overhead electric hoist installed on a jib crane. the clamp was attached to the side away from the plasma table; the clamp was manually tightened. the employee lifted the clamp and sheet up enough to clear the top of the table and moved the bottom of the sheet to the table's edge and then proceeded to lay the metal flat on the table. the employee had to make adjustments to the metal's position and stood up on the table. after the last adjustment, the employee went to get off the table and the sheet fell from the clamp. the sheet struck the back of the employee's legs as it fell to the table resulting in broken bones in the right leg.",OSHA
hand or arm injury,"caught in running equipment or machinery during maintenance, cleaning  around 6:45 pm on june 11, 2021, an employee was troubleshooting a milk filler machine that he was operating. the machine moved, causing a laceration to his right hand that required hospitalization.",OSHA
*** Not Classified,nonclassifiable an employee was hospitalized after sustaining a forklift injury.,OSHA
hand or arm injury,"caught in running equipment or machinery during regular operation an employee was retrieving pouches of cereal for a conveyor belt. her right thumb was caught between the belt's moving parts, causing a partial amputation.",OSHA
"slips & trips, foot or leg injury","struck by object or equipment dropped by injured worker an employee was moving a crate of milk when it fell on his foot, lacerating it. the wound became infected and he was hospitalized.",OSHA
"general injury, slips & trips","fall on same level due to slipping  an employee pulled up to a wellsite and exited his truck. he was walking over to a control unit to restart the well when he slipped on ice, suffering a hip fracture.",OSHA
weather related issue,"exposure to environmental heat an employee developed heat stress while cleaning a plant site and securing a load to a semi-trailer throughout the day, requiring hospitalization.",OSHA
hand or arm injury,compressed or pinched by shifting objects or equipment an employee was loading cars and moving a lever to adjust platform heights. the wrong lever was moved while the employee's hand was resting on a long pole. his left index finger got caught on the hydraulic platform and was partially amputated.,OSHA
"hand or arm injury, slips & trips","injured by slipping or swinging object held by injured worker a temporary employee was lifting a drum of product to be dumped into a mixer when the drum slipped and caught the employee's left middle finger between the drum and frame, resulting in a fingertip amputation.",OSHA
"dropped object or material, foot or leg injury","struck by falling object or equipment, unspecified an employee was pushing a lorry tank on a monorail when the monorail broke, causing the lorry tank to fall over and break the employee's leg.",OSHA
"hand or arm injury, slips & trips","fall on same level due to tripping over an object  an employee was lifting a hydraulic cylinder off the shelf, tripped on nylon webbing, and fell to the ground while holding the hydraulic cylinder. the cylinder smashed his left hand and partially amputated his left thumb.",OSHA
"fall from or working at height issue, foot or leg injury",fall from collapsing structure or equipment 6 to 10 feet an employee was installing structural steel. the beam the employee was sitting on dislodged and fell off the support it was on causing the employee to fall 10 feet. the employee was hospitalized with a leg laceration.,OSHA
*** Not Classified,"direct exposure to electricity, unspecified on 12/25/16 at approximately 11:30 am, an employee sustained first degree burns to the forearms and right hand while troubleshooting an energized pneumatic document tube system's panelboard.",OSHA
hand or arm injury,"compressed or pinched by shifting objects or equipment an employee was loading an oil drum onto a hand truck. upon placing the oil drum onto the hand truck, the employee's fingers were caught between the two objects. the employee sustained amputations of the right middle and index fingertips.",OSHA
"lifting or moving loads, head or face injury, general injury, slips & trips","nonroadway collision with object other than vehicle, n.e.c. an employee was driving a forklift when he ran into a building column and fell off of the forklift to the ground. he hit his head on the floor and suffered shoulder pain and cuts/scratches. a seat belt was not worn at the time of the incident.",OSHA
"ppe non-compliance, general injury, back injury, fall from or working at height issue, site compliance or practice issue","other fall to lower level 16 to 20 feet an employee was standing at the edge of the furnace pit and was going to push out the lining on the furnace. the employee fell approximately 20 feet into the furnace tank and sustained broken vertebrae, two broken ribs, and a brain bleed. the employee was not wearing fall protection at the time of the fall.",OSHA
