category,text,dset,scores
"covid, fall from or working at height issue","wood employee and a partner contractor resulted positive during the pre mobilization rt-pcr test the shallow water platform crew was in the acacia hotel for a seven(7) day quarantine before mobilization. on the 7th day, the crew underwent rt-pcr test as required by the client.  1 wood and 1 contractor partner turned out positive and was not allowed not allowed to mobilize with the group.  both ips were informed by our oh doctor and was advised to stay in the quarantine hotel for another 10 days. local government was informed for their documentation as well as  the client for their flight cancellation. oh team will be in close monitoring for the 2 ips. ",ORGP,2
"hand or arm injury, slips & trips",caught in running equipment or machinery during regular operation an employee was operating a press brake when his hand slipped into the jaw resulting in fractures to four fingers.,OSHA,1
hand or arm injury,"struck by rolling object or equipment being pushed by injured worker while pushing a wheel caster with a cart, an employee ran into another piece of equipment. this created a pinch point between the employee's hand and the equipment, resulting in a left fifth fingertip amputation.",OSHA,1
fall from or working at height issue,"container door opened during supply vessel deck operations migrated from legacy cairs incident #32131prior toback loading container cm 2293 onto the vessel highland guardian (4100052747) the container was checked, closed and tagged prior to lifting onto vessel.the container was then lifted from the deck to the supply vessel and during this process the container was being positioned on the vessel deck (other back load containers were already in place). it is assumed that whilst positioning the container the door securing bracket had twisted open.as the positioning was in progress the vessel master informed the crane op that he thought the door has sprung open when landed. the crane op instructed the vessel master and deck crew that he would lift the container and move so that the vessel deck crew could check the container doors.the container was lifted slightly off the vessel deck and moved to a suitable position on the deck (approx. 6 feet away from it's original position) and then lowered down until there was slack within the bridle. the crane was never unhooked from the container. the vessel crew then closed the door and made secure and then instructed the crane op that the container could be placed back into the original position. on completion the crane hook un hooked and normal supply vessel operations continued. migrated from legacy cairs - see detailed description",ORGP,2
hand or arm injury,"compressed or pinched by shifting objects or equipment an employee was operating a mechanical punch press when their left hand was crushed by the press, resulting in a finger amputation.",OSHA,1
hand or arm injury,"compressed or pinched by shifting objects or equipment on february 27, 2020, at approximately 6:40am, an employee was unhooking a load of galvanized steel from a crane when his right pinky finger was caught between the hook and the galvanized steel crushing the fingertip. the employee was hospitalized for surgery to remove the crushed fingertip.",OSHA,1
