category,text,dset,scores
vehicle incident general,"mobile elevated work platform (mewp) used for wah electrical workscope sunk into ground when carrying out centrica maintenance workscope for periodic inspection & testing on lighting and power circuits within lcp 2 barrow nmt- n4, a mobile elevated work platform (mewp) was used to gain access at height. to enable access for other road users, the mewp was parked part on the roadway and part on stoned chippings, when the two wheels positioned on the stone chippings began to sink (400mm into the ground). the operator lowered the basket immediately and turned off the engine and the area was cordoned off with barriers.   centrica arranged for lawson’s 80 tonne crane operating on site to carry out lifting operations to remove the mewp to safe area.  ",ORGP,1
hand or arm injury,"injured by slipping or swinging object held by injured worker an employee was operating a tomato slicer when she contacted the blade with her cut glove, resulting in a left thumb tip amputation.",OSHA,1
theft,"high voltage cable stolen from laydown area  approximately 185 meters of high voltage cable was stolen after thieves cut through the site laydown perimeter fencing  and removed 185 meters of cable from its drum scene of theft  secured, gent police informed and perimeter fencing repaired  ",ORGP,1
fall from or working at height issue,"during  a managers tour it was noted by the group that 2 scaffolds had deficiencies with access and toe boards.  on june 27th 2018 during a tour with management through th-1 scaffolds bulids in two locations were found with deficiencies 1. over the conveyour belt & 2. for accesss to the scafier magnet. both scaffolds were erected by issl a subcontractor of tkis. at the time deficiencies were noted no workers were on the scaffold and the green tag had expired as no work was required on the decks in recent days. as noted scaffold 1. over the conveyour was deficient in with a lack of toe boards, the work that had gone had previously occured on this deck was: inspection & sticker placement on a fire water line. verbal discussion regarding not allowing tools on the deck had occured with the fire water contractor & erector but this was not noted on the tag. it's been noted the access could have been improved by adding a ledger for additional fall protection at access/egress point. scaffold 2. erector relied on users using a 4 foot bay as fall protection to access a deck that reached 12 feet, erector recognizes additional ledgers in the bay would have provide further protection against a fall. scaffold was put out of service and an investigation was initiated.",ORGP,1
covid,person in quarantine tested positive for covid-19 person in quarantine tested positive for covid-19. required to isolate for at least 10 days.  required to isolate for at least 10 days.,ORGP,1
foot or leg injury,"during the dismantling of a scaffold in the roof b23, a worker twisted his ankle.  on december 21st 2016, during the dismantling of a scaffold in the roof of b23, a worker twisted his ankle. this happened because he placed his foot on a wooden panel laying on the floor for storage purpose.the event occurred at 15:30; the ip was taken into care by the hse amecfw who accompanied him to the gsk infirmary.the “first aider” sent the worker to the nearest hospital to have x-ray of the ankle.at 17:45 the ip was accompanied to the hospital by the hse supervisor of the company, together with amecfw hse supervisor and cm.the i.p receved his medical report at 18:30, in the report there aren’t  evidence of fracture or other physical damage.the following day the worker resumed its normal work without any restriction.   ip accompanied to the hospital for x-rays.",ORGP,1
lifting or moving loads,when driving in via gate 1 with a big mobile crane the barriere pole came down after badging in.  when driving in via gate 1 with a mobile crane the barriere pole came down after badging in. the crane driver did not notice that he passed the pole which was open at this time and when badging the pole came down and hit the mobile crane. security personnel asked the mobile crane driver to reverse on to the main parking to assess the damage no damage was visible on both crane or pole. reversed to check for any damage. no visible damage found by both parties irem/em security.,ORGP,1
burns,"contact with hot objects or substances while disconnecting a steam fitting from a railcar, an employee suffered thermal burns to the hands/arms from hot water that released from the fitting.",OSHA,1
"fall from or working at height issue, dropped object or material","dropped object - whilst conducting lifting operation the fly wheel pulley became detached from its support spindle, falling 3 metres. whilst conducting lifting operation for train 2 intercooler dome end in m5 module, when the rigger was pulling the gypsy chain, he felt it go light in his hands and the fly wheel (weight to be confirmed approx.. 1-2kgs) became detached from its support spindle, falling 3 metres onto a scaffolding platform, which is approximately and 8 metres above deck level. the lifting operation ceased immediately and the area / equipment assessed in order to determine if there was any immediate danger.  once it had been determined that the area was safe, liaison with the rope access team took place in order to gain access to the beam trolley to refit components, enabling the load to be traversed and lowered down to a safe position on the deck.",ORGP,1
"vehicle incident general, weather related issue",lid from wooden crate blew off and exited the yard striking a parked vehicle lid from wooden crate stored in the yard became detached during adverse weather and flew over perimeter fence striking a parked car causing damage to both the bonnet and roof of vehicle owned by a wood employee which was parked within the designated parking bays. area made safe and remainder of wooden crate broken down and secured on site,ORGP,1
head or face injury,"hitting, kicking, beating, shoving an intruder assaulted an employee and struck her head. the employee sustained head trauma.",OSHA,1
hand or arm injury,"caught in running equipment or machinery, n.e.c. at about 8:45 p.m. on february 6, 2019, an employee was operating a blow bagger. the employee noticed that the blender, which is operated in close proximity to the bagger, no longer had material flowing from the valve. the employee was investigating this issue and amputated his left hand in the rotating blade in the valve.",OSHA,1
"vehicle incident general, competency, site compliance or practice issue","employee was entering the south section of the site when he turned sharply off-track and drove over a free-standing conduit marker for an open land drain. the employee claims he did not see the marker and that he was in a hurry back from the storage yard with materials that were required from the day. the employee's driving was reckless and dangerous. his driving privileges on site have been revoked/suspended until he undergoes successful refresher (site driving) training and an eye test. only minor damage to the marker was recorded, no injuries were sustained.",MANF,1
"vehicle incident general, vehicle Incident involving animal","a wood group electrician was driving to the field on i-90 and hit a deer.  no damage to the truck and no injuries. migrated from legacy cairs incident #31601the wood group journeyman electrician was driving on interstate 90 east of buffalo, wyoming at pre-dawn hours. as he was driving, he sawtwo deer on the road and began slowing down. one deer was standing on the right shoulder and the other was in the right lane walking toward the left shoulder of the road. the truck was positioned to drive between the two deer, but the deer on the left turned and ran in front of the truck. the employee was unable to avoid hitting it. the deer did not cause any damage to the truck and there were no injuries. migrated from legacy cairs - see detailed description",ORGP,1
"slips & trips, foot or leg injury",wg employee was getting dressed in the morning at wg man camp and felt discomfort on his left inner thigh. as soon as he looked down a scorpion fell from his leg. axiom was contacted and first aid measures were appropriate for this incident. migrated from legacy cairs incident #34144non-work related incident; wg employee was getting dressed in the morning at wg man camp and felt discomfort on his left inner thigh. as soon as he looked down a scorpion fell from his leg.axiom was contacted and first aid measures were appropriate for this incident. migrated from legacy cairs - see detailed description,ORGP,2
hand or arm injury,"caught in running equipment or machinery during maintenance, cleaning  an employee was clearing product out of the cutting machine and amputated the tip of his left middle finger.",OSHA,1
"vehicle incident general, lifting or moving loads, competency, site compliance or practice issue","workers were moving materials by trailer and truck as part of the service metering project. while in transit the suspension of the trailer failed on one side, the load became unstable, shifted to one side and over turned the trailer. no injuries were sustained to the work crew. on investigation it was found that the suspension system on the trailer was designed for roadworks only and not suitable for the proposed off-road and heavy load transportation tasks. a visible pre-start check was completed on the day for the trailer and truck but it was not documented. this work was part of the minor works undertaken by the maintenance team. training was provided for 4wd as per tna but no training is currently required for trailers, in relation to hitching, pre-checks or load restraint.  no record found and not required under profile within contract training. nonetheless the incident was a result of lack of competency and supervision on site. the workers involved were inexperienced and working without senior supervision.",MANF,1
foot or leg injury,caught between rolling powered vehicle and other object an employee was loading a cinder block into a golf cart. the block rolled and disengaged the parking brake. the cart pinned the employee's leg against the pallet of cinder blocks and broke it.,OSHA,2
"slips & trips, foot or leg injury","fall on same level due to slipping  an employee arrived at work in the company parking lot and was getting out of her car. the employee slipped on ice in the parking lot and fell, resulting in a broken leg and hospitalization.",OSHA,1
"hand or arm injury, back injury","struck against moving part of machinery or equipment an employee was cutting down trim kit pieces with a mitre saw. the employee was holding the board in place when the blade came down. the board kicked back and pulled his left hand into the table, amputating his index finger (at the second knuckle) and the tips of his middle and ring fingers.",OSHA,2
covid,employee communicated a positive confirmation for covid-19 an employee communicated a positive confirmation for covid-19 as part of on-site voluntary testing. employee has been in self-isolation since date of participation of voluntary testing pending results. appropriate notifications have been completed. ,ORGP,1
"vehicle incident general, lifting or moving loads","preventable, personal vehicle, minor damage, no injury. wood driver backed personal vehicle into residential driveway and rear bumper struck curb/brick retaining wall, causing damage to the vehicle bumper. no injuries, no damage to curb. incident reporting initiated.",ORGP,2
"dropped object or material, general injury, fall from or working at height issue, slips & trips","ip tripped/slipped and as doing so dislocated his shoulder trying to break his fall. migrated from legacy cairs incident #30814backgroundwgpsn bp contract personnel are currently involved in operations on the bp mungo platform, where additional accommodation is being commissioned in order to both modernise and increase living space as required for use.having completed a drilling campaign at bp mungo, the ensco 101 jackup rig remains alongside to provide accommodation and facilities until bp mungo accommodation operations are completed.personnel involved offshore have access to either a locker room located on the bottom deck of ensco 101, or a locker area within a corridor near to a stairway leading to the galley. ip is employed by wgis as a rope access electrical technician (ltd co) and on saturday 9th july 2016 was engaged in work scopes relating to said accommodation operations.at the time of the incident certain ppe locker doorscould notbe closed or locked due to broken locks or lost keys, some had locks missing and most doors ajar. there are 42 lockers in this area, enough for all mungo personnel on rotation. some lockers have been “claimed” by individuals and are not available during that individuals field break which results in others requiring to 'live out of kit bags' stored on shelves or on the floor area.timeline10:00 11:50hrs ip was pulling cable in mungo ler.11:50 broke for lunch and transit across gangway from bp mungo to e101 locker area12:00 broke for lunch an at approx. 12.00hrs after removal of ppe went round corner from lower locker room to go upstairs, slipped on what seems to be a piece of shiny paper / cardboard form coveralls ppe packing, slipped on his right foot an on reaching out with left arm to protect fall has dislocated his shoulder, his colleague was close by and raised the medic 12:08 medic arrived on scene to treat ip12:12 ip transferred to sick bay - ip made comfortable, pain relief administered, coastguard helicopter mobilised, classed as a non-critical medevac.12:40 investigation initiated with e101 oim13:00 safety stand-down held with all mungo dayshift personnel prior to return to work14:45 coastguard helicopter arrived on e101 to transfer patient to aberdeen royal infirmary15:01 medivac departure form e10116:00 arrived at bond heliport and transferred to aberdeen royal infirmary (ari). case managed by paul guntril, wgis senior operations manager.18:00ip released from ari with shoulder re-set.n.b. as part of the investigation, it was unknown whether the piece of paper was dropped by ip, another individual or fell out of a nearby locker that was insecure.from wgis - given ip is a ltd co person and only suitably employed as a l3 rat, there is no alternative office job he could fulfill.updatewhilst at home a few days after initial treatment, ip was walking to the shop when he felt further pain to his shoulder. on examination, he appears to have dislocated it again.on 29th july, ip had an operation on the injured shoulder and will take time to recover through regularassessment by his gp.wgis have and will maintain contact with ip for welfare reasons. updates will be saved in the bp contract incident folder on g\ drive. migrated from legacy cairs - see detailed description",ORGP,2
hand or arm injury,part of occupantís body caught between vehicle and other object in nonroadway transport incident an employee was turning an electric pallet jack. the employee's left little finger was pinched between the pallet jack's handle and a hinge on a freezer door. the fingertip was partially amputated.,OSHA,1
"vehicle incident general, head or face injury, foot or leg injury, fall from or working at height issue, lifting or moving loads","pedestrian struck by vehicle in nonroadway area, unspecified an employee was walking through the warehouse going to lunch when he was struck by a forklift, suffering a broken ankle, concussion, and abrasions to the legs and arms.",OSHA,2
hand or arm injury,"caught in running equipment or machinery during regular operation an employee was tightening the packing bolts on a beam pumping unit in the oil field by using an air impact wrench when the head of the unit, while in a down stroke, came in contact with the impact wrench forcing it downward and mashing the tool against the left index finger. the employee sustained a partial amputation of the left index fingertip.",OSHA,1
"general injury, fall from or working at height issue, slips & trips, foot or leg injury","other fall to lower level, unspecified an employee was on scaffolding framing up a fur down (dry wall ceiling) and hanging sheetrock. the employee fell and was hospitalized for broken ribs and a leg contusion.",OSHA,1
"line strike, lifting or moving loads, competency","while excavating a trench over an existing buried services conduit, the bucket of the excavator made contact with the conduit causing a tear/damage approximately 6 inches square. the spotter was not paying attention during the task and did not give sufficient warning to the machine operator that the bucket was operating too close to the exposed conduit. on investigation, it was clear that the worker performing the spotter role did not have the required training/certification to perform the spotter task. investigation is ongoing. ",MANF,1
covid,wood team member tested positive for covid-19 while working from home a wood team member experienced mild signs and symptoms associated with covid 19 and was seen and tested by his health care provider. the employee received a positive test result. team member reported to hsse recommendations were send to the team member by hsse,ORGP,1
dropped object or material,"caught in running equipment or machinery during regular operation on march 13, 2017, an employee was operating a cnc machine and was loading a 2-foot pup joint into the chuck spindle. the pipe dropped in the back, resulting in the pipe coming up in the front. the employee's right hand was located inside the pipe and was smashed between the pipe and the chuck of the machine. ppe was not worn at the time of the incident.",OSHA,2
"general injury, fall from or working at height issue, lifting or moving loads, competency","ip suffered tendon injury to his right shoulder while moving scaffold material that had been returned from site. ip reported the discomfort the day after the incident and attended his gp where he received diagnosis and a prescription for medication. when questioned about the incident, the ip said that he did think that there were any additional factors that impacted the incident. the operation of moving the materials is fairly routine and an operation that the ip has performed the task each week since he started on the site. the injury have been caused by over-reaching / over-loading, the ip said that he did try to move four scaffold tubes at the same time. ip had not yet received his manual handling training due to delay in scheduling by p&o. ip should not have been given these tasks to do before he had received the training. the incident occurred in the scaffold yard and weather conditions were dry with no wind.",MANF,2
"hand or arm injury, vehicle incident general","three amec foster wheeler vehicles were travelling on a road for site visit in a convoy, one following other and 2 cars collided  the three vehicles pulled away on close convoy from a parked location adjacent the future marjan gosp and travelled no more than twenty meters when car three hit car two on the rear right hand side and, having swerved to avoid a collision damaged the car three front left hand side.the accident occurred at a speed bump at speeds no higher than 10 km /hour, car two was virtually at a standstill at the speed bump. there were no injuries to personnel. the accident was duly reported to the police and to the amecfw transport supervisor. incident reported to saudi traffice authority (najm)",ORGP,2
"near miss, competency","small-scale scaffold collapse on the north of the site, nobody injured, near-miss. on investigation it transpired that the scaffold had been erected by an unqualified team who did not have the required certification to erect the scaffold structure. ",MANF,1
"competency, foot or leg injury","a young and inexperienced site worker was using a circular saw to cut plywood on site on friday morning. the saw had its protective latch/cover removed to speed up the cutting of the plywood on site. while cutting the boards, that platform that was being used collapsed on one side causing the worker to loose his balance and fall to the ground with the saw. the spinning disc of the saw caused a cut in the knee of the worker. the worker was treated with first aid before being transported to accident and emergency department of james's hospital for treatment. he received 20 stitches for the wound and was discharged home.",MANF,1
hand or arm injury,"mtc; veolia (walters); crush right index & middle finger; ks-2017-0012 ip was tasked with installing infill structural steel.  after lowering i-beam into place with a chainfall, ip reached under beam with gloved right hand to remove nut from bolt style lifting lug.  while doing so, i-beam shifted pinching ip's right hand middle and index fingers against another piece of the structure.   work stopped and scene frozen.  ip was taken to onsite medic clinic for assessment but referred to local hospital where ip received sutures to right index finger before being released to regular duties.  further details pending investigation findings.",ORGP,1
"general injury, slips & trips, foot or leg injury","fall on same level, left shoulder and knee bruise employee was transporting equipment down a set of steep stairs. it was unlit, however another employee had the light directed down the stairs. ip either missed the last step or slipped forward on some debris.  ip fell and impacted the wall with left shoulder and left knee. knee and shoulder are sore and likely slightly bruised.  internal reporting initiated, workcare contacted, self care chosen.",ORGP,1
"general injury, vehicle incident general","nonroadway collision with object other than vehicle, n.e.c. an employee was driving down an aisle in a powered industrial truck. the truck hit some racking and a pallet on the rack struck the employee. the employee suffered a broken hip and was hospitalized.",OSHA,1
"vehicle incident general, lifting or moving loads","employee struck by falling tree branches the client’s site manager was filling in for an on-site excavator supporting our geotechnical test pit program, who was acting carelessly, rushing and agitated.  excavator operator knocked over a poplar tree toward our employee that resulted in a minor scratch to his face from a branch.  this incident led to a verbal argument the following day with our field technician, which led to him leaving the site.  based on discussions with the client, it was agreed to suspend work until the next phase.",ORGP,2
"vehicle incident general, slips & trips, foot or leg injury","fall on same level, n.e.c.  a usps mail carrier was walking to a resident's door with a heavy parcel. as the carrier moved from the side of a carport to reach the front porch, the parcel hit the top of the carport. the carrier fell backward and suffered a broken right fibula, tibia, and ankle.",OSHA,1
hand or arm injury,"caught in running equipment or machinery, unspecified an employee's left hand was caught in a rolling mill. two-thirds of the employee's middle and ring fingers were amputated.",OSHA,1
hand or arm injury,reciprocating saw cuts right thumb injured person was using a reciprocating saw to cut reinforcing bar.  when his right thumb was lacerated.  the laceration required 3 sutures to close.  employee was released back to work.  incident is still under investigation. employee was taken to local hospital for treatment.  scene of accident was secured and investigation is on-going.,ORGP,1
lifting or moving loads,"while rotating the crane to refuel, the counterweight from the crane lightly touched the scaffolding r-103. after the set-up of the crane in final position a truck with gasoline arrived at the location in order to refuel the crane. at the moment the truck arrived the rigger was outside the unit to pick up his safety harness. in order to refuel the crane the crane had to be rotated. during this rotating / movement the counterweight of the crane lightly touched the scaffolding r-103. while the rigger was looking for a safety harness the crane operator decided to rotate the crane without presence of the rigger and/or spotter. activities suspended for field investigation.",ORGP,1
hand or arm injury,"compressed or pinched by shifting objects or equipment an employee was helping to remove a belt from a pulley attached to a fan used in the ginning process. while moving the belt manually, his finger got pinched between the belt and pulley, partially amputating his right pinky fingertip.",OSHA,1
"fire, burns","nonstructural fire, n.e.c. an employee was branding a tire. a piece of rubber came away from the tire and remained on the branding iron. when the employee flung the burning piece of rubber onto the floor, it caught rags on the floor on fire and the employee suffered burns to the left lower leg.",OSHA,1
"hand or arm injury, knife incident, fall from or working at height issue, foot or leg injury",employee was washing dishes and cut left thumb on knife. non work related. migrated from legacy cairs incident #33689employee (operator) was washing dishes and cut his left thumb on a knife. received 1st aid treatment from field medic. returned to work. this is a 4 man platform with no galley cooks. this is an operator not a galley hand or cook. migrated from legacy cairs - see detailed description,ORGP,2
