category,text,dset,scores
"slips & trips, foot or leg injury","fall on same level due to slipping  an employee was photographing underground utility marks while walking on the sidewalk when he slipped and fell on ice, fracturing his right leg.",OSHA,1
"hand or arm injury, general injury, head or face injury","mechanical fitter received a small laceration to his right cheek from a flying fragment off a steel drift used in realigning flanges at approximately 10.45 on tuesday 26th june a mechanical fitter was working on a flange located on the reboiler at an due to the bolts not realigning when lifted into place  a drift was required which is a solid steel bar and has a tapered end. on removal the ip held a mash hammer in his right hand and took it from his left shoulder to be able to hit the drift. the ip states the drift was being removed easily from the flange and didn’t require much force, after a few blows the ip felt a slight nick to his right cheek the ip immediately went and reported the incident. the ip reported the incident to his supervisor peter harkin and ineos employeethe supervisor follwed the correct reporting proceedure and dialled all the 2222 which alerted the shift manager and emergency servicesthe ip attended the medical centre where the area was checked for any forgeign body and was seen to be clean.the medical centre applied a plaster to keep the area clean and the ip returned to work.",ORGP,2
hand or arm injury,"struck against moving part of machinery or equipment an employee was working from home constructing an a-frame easel to be used at the store. he was operating a table saw, turned the saw off and reached for the cut piece of wood. the still moving blade severely lacerated his left index and middle fingers. he was hospitalized.",OSHA,1
covid,the worker received a positive test result for covid-19 while on pre-embarking preparation to whp-b. the worker received a positive test result for covid-19 while on pre-embarking preparation to whp-b. the ip is symptomatic. the worker has symptoms such as body pain and fever. the pi received guidance from the nursing technician regarding the necessary care and will be sent home for quarantine period.,ORGP,1
"back injury, general injury","electrician helper experienced lower back muscle spasm while coiling 4 conductor #2 cable on the ground, employee began to experience pain in his lower back. after an on-site pa examination, it was determined that the employee had a muscle spasm in his lower back. employee reported incident to his supervisor and was taken to the on-site pa where he was evaluated, treated, and released back to work without restrictions.",ORGP,1
hand or arm injury,"caught in running equipment or machinery during maintenance, cleaning  an employee was attempting to unclog a heat shrink machine when the machine's blade amputated the employee's right middle fingertip.",OSHA,1
"fall from or working at height issue, foot or leg injury",fall from collapsing structure or equipment 6 to 10 feet an employee was installing structural steel. the beam the employee was sitting on dislodged and fell off the support it was on causing the employee to fall 10 feet. the employee was hospitalized with a leg laceration.,OSHA,1
hand or arm injury,"caught in running equipment or machinery during regular operation an employee was grinding a part when the grinding wheel caught the tip of his glove, pulling his finger into the grinder and resulting in a fingertip amputation.",OSHA,1
"fall from or working at height issue, lifting or moving loads, foot or leg injury","struck bump, hole, rough terrain on driving surface, nonroadway a landscaper was mowing the grass at a high school, using a stand-up riding mower. a hole, tree stump, or root caused the mower to bounce and his right foot was caught between the mower's deck and its discharge platform. he suffered a broken toe and was hospitalized.",OSHA,2
"general injury, slips & trips","fall on same level due to slipping  on march 1, 2018, at 2:30 p.m., an employee was entering the break room, which had a newly surfaced floor, when she slipped and fell, fracturing her hip and requiring hospitalization. her boots were wet at the time of the incident.",OSHA,1
head or face injury,"hitting, kicking, beating, shoving an employee was punched by another employee. he was hospitalized, suffering from a concussion and loss of teeth.",OSHA,1
"line strike, lifting or moving loads, competency","the boom of the site crane cam in contact with am overhead powerline while being relocated.  the correct details of the task were not recorded on job safety assessment (jsa). specifically, the planned travel path (waypoints) were not plotted/checked, and the route was not walked/validated by the team before moving the crane's location. the worker who was tasked with spotting responsibility, had no training for spotting/banks-man. several attempts, verbal and visual were made to stop crane from moving forward were ignored by the operator.",MANF,1
electric shock or issue,"small electric shock received from fuse box  observation of a building prior to demolition/ renovation. when visually inspecting the building for building substance and hazardous material. an already open fuse box was visually inspected for possible asbestos containing conductor boards from a thought safe distance. while around the fuse box the person experienced a small electric shock. how exactly contact with electricity occurred is uncertain/ cannot be reconstructed. the unsafe condition has been described and reported to the client to prevent further potential incidents.   alexander bartenstein was wearing full appropriate ppe including working cloths, safety boots and gloves. he could continue his work without delay. stated lost time was due to internal review of the situation.  on 22.08.2019 alexander bartenstein informed the project manager/ line manager annette littmann as well as the hse- coordinator alexander knacker about the incident. it was decided that for safety reasons a visit to the doctor (occupational physician and cardiologist) on the same day was appropriate where an electrocardiogram was carried out that showed no abnormalities. the instance has been discussed in detail with the doctor and the patient was assured that no further consequences are to be expected.  reported to project manager.  ip was seen by occ health physician, had ecg which showed no abnormalities",ORGP,1
"head or face injury, foot or leg injury","struck by dislodged flying object, particle an employee was standing near a winch system when the i-hook to the system broke and whipped around, fracturing the employee's right lower leg.",OSHA,2
"theft, head or face injury, lifting or moving loads","a skid steer operator, while moving parallel to a concrete wall started to turn to his right.  during this maneuver the skid steer’s left rear panel made contact with a piece of conduit attached to the concrete wall, causing damage to the conduit. migrated from legacy cairs incident #303654:10 pm – the crew was backfilling a ditch for the drains on the containment pad4:15 pm – the skid steer operator was moving out of the way of the track hoe to allow the track hoe to perform the final cleaning of the top of the ditch4:20 pm – the skid steer operator, while moving parallel to the wall started to turn to his right4:20 pm – the skid steer’s left rear panel made contact with a piece of conduit and broke the 90 degree piece of conduit4:25 pm – the crew contacted the superintendent about the incident4:30 pm – the superintendent contacted the hse department4:31 pm – the crew shut down operations until further instruction was received by management4:50 pm – the crew was shut down and sent home5:00 pm – the operator was taken down for a drug screen and passed both testsnotes:no employees were injured in this incidentthe skid steer was not damaged in this incidentradios were utilized during the operationsa “spotter” was watching the skid steer from the track hoe and did call on the radio for the skid steer to stop, but was too latea designated spotter was not assigned for that piece of equipment multiple crew members were on the ground but did not take the lead and become a designated spottera toolbox talk has been held in the past for spotting skid steer operations with two of the five crew membersthe operator had his own spa with a spotter as a control for hazards, but switched crews and did not sign on the new spa migrated from legacy cairs - see detailed description",ORGP,2
covid,worker tested positive for covid-19 worker who went for his second covid-19 test at the end of his quarantine period. result positive advise the worker to continue isolate from his family and wait for moh instructions.,ORGP,1
"general injury, fall from or working at height issue, vehicle incident general",struck by other falling powered vehicle an employee was putting a motorcycle on a lift when the bike missed the front wheel slot and fell on him. he suffered a hip contusion.,OSHA,2
"general injury, slips & trips","fall on same level, n.e.c.  an employee had just finished unloading a shipment of cardboard boxes.  the cardboard boxes were on pallets; the individual pallets and stacks of cardboard boxes were secured with banding straps.  the employee grabbed and pulled on a banding strap on one of the pallets to try and straighten the pallet by a few inches to align with the other pallets.  when the employee pulled on the banding strap, the strap broke and the employee fell to the floor.  the employee broke his left hip.  the employee was hospitalized for hip surgery.",OSHA,1
eye injury or irritation,a worker felt irritation in his left eye in the evening around 19:50pm a worker of altrad felt an irritation in his left eye.the worker presented was escorted to the contractor clinic where he received a first aid treatment and returned to work. worker informed his supervisor and went immediately to the contractor clinic accompanied by his hse adviser.dust particle removed fa treatment,ORGP,1
"fall from or working at height issue, vehicle incident general","pedestrian struck by forward-moving vehicle in nonroadway area an employee was struck and run over by the front left tire of a rough terrain forklift. the rough terrain forklift was carrying a load of logs, and the forklift operator was driving towards the scale.  the injured employee was hospitalized.",OSHA,2
"head or face injury, lifting or moving loads","struck against stationary object or equipment, n.e.c. an employee was riding in an elevator that ascended at a rapid pace when her head hit the ceiling. she was hospitalized with head injuries.",OSHA,2
hand or arm injury,"caught in running equipment or machinery during maintenance, cleaning  a temporary employee was preparing to clean excess sludge from a slow-rpm paper roller. the roller caught the employee's shift sleeve, pulling his left arm into the in running nip point and breaking bones in the arm.",OSHA,1
covid,individual tested positive for covid-19 individual tested positive for covid-19 after displaying symptoms. individual has not been to site in the 48 hours prior to the positive test. none,ORGP,1
"hand or arm injury, security or general safety concern, slips & trips","ip was pulling on a pipe wrench to loosen a check valve when wrench slipped and ips finger smashed between wrench and water line on june 16, 2019 at the stevens battery in raccoon bend, tx, ip and a coworker discovered a 2 inch check valve would not hold pressure on the water pump line. they shut the pump and bled the line pressure down using a needle valve. the coworker then attempted to break loose the 2 inch check valve for repair utilizing a 24 in pipe wrench. the check valve would not loosen, so ip stepped in to help break it loose. ip was pulling on the wrench while coworker was pushing. while doing so, the wrench slipped causing ip's left index finger to become caught between the wrench and the water flow line tubing. ip was taken to hospital and was diagnosed with a fractured left index finger. ip contacted supervisor of incident, supervisor advised ip to contact axiom. axiom advised ip to go to local hospital. account manager met ip at hospital. ",ORGP,2
slips & trips,"fall on same level due to slipping  an employee slipped and fell in an office hallway, landing on the tile floor, and suffering a broken kneecap.",OSHA,2
"confined space non-conformance or issue, site compliance or practice issue","no injury. lsr violation.  welder crawled 40’ into a new, 40’ joint of pipe where it connected to a smaller fitting to back weld.  no injury.  lsr violation.  at approximately 14:00 on october 16, 2019, the subcontractor’s fabrication crew was working in the se fab area in the cowboy station.  it was clear, sunny and dry.a welder was welding a reduced fitting onto the end of a 40’ joint of 30” pipe.  he felt he needed to back weld the inside of the weld and crawled 40’ into the pipe and began welding.  he had a fire watch who he was verbally communicating with.  this violated the wood pii life saving rule to obtain authority before entering a confined space.when the chief inspector saw what was happening, he stopped work and had the welder exit the pipe.  the subcontractors field safety, wood field safety and wood inspection were not aware the welder planned to enter the cs.  the site does have a cs policy and procedure to enter pipe and backfill a weld.  none of the steps in the procedure were followed. when the chief inspector saw what was happening, he stopped work and had the welder exit the pipe.  the subcontractors field safety, wood field safety and wood inspection were not aware the welder planned to enter the cs.  an investigation is ongoing.",ORGP,1
"vehicle incident general, vehicle Incident involving animal, lifting or moving loads",wgpacs employee was driving on highway when a deer emerged from the left side of the road and struck wgpacs vehicle along the driver side door and caused damage to the front headlight. migrated from legacy cairs incident #31516wgpacs employee was driving on highway when a deer emerged from the left side of the road and struck wgpacs vehicle along the driver side door and caused damage to the front headlight. there were no injuries. migrated from legacy cairs - see detailed description,ORGP,2
hand or arm injury,caught in running equipment or machinery during regular operation an employee was in training to use a metal stamp machine when his left hand got caught in the machine crushing the left ring finger.,OSHA,1
covid,ip tested +ve for covid-19 ip tested +ve for covid-19 line manager in contact,ORGP,1
hand or arm injury,injured by slipping or swinging object held by injured worker an employee was performing preventative maintenance on the control panel for a piece of equipment. the employee was using a spring loaded manual hand tool to cut a wire when the blade of the tool partially amputated his left thumb tip.,OSHA,1
covid,a vancouver employee tested positive for covid-19 an employee tested positive for covid 19. no workplace exposure.  the case was reported to hsse and p&o dept. ,ORGP,1
hand or arm injury,struck against moving part of machinery or equipment an employee suffered a left thumb tip amputation while operating a band saw. cut-resistant gloves were not worn at the time of the incident.,OSHA,1
back injury,"nwr - sudden onset of back pain after waking up a team member woke up in the morning to a sudden onset of back pain. this occurred on day 5 of pre-mobilisation isolation at bladin village in darwin. attended on-site medic and received otc anti-inflammatory, pain medication.advised on stretches that would alleviate the pain.",ORGP,1
vehicle incident general,"a wood vehicle was damaged from debris after hours from a nearby tornado while parked at the client yard. on march 12, 2019 at approximately 10:30 pm an unoccupied wood vehicle was damaged by debris from a tornado that came through the area after hours. the wood vehicle was parked in the client yard se of andrews, tx. the debris from the tornado caused damage to the front end of the vehicle. reported to management and hse team. ",ORGP,1
"general injury, fall from or working at height issue","other fall to lower level, unspecified an employee fell into a ditch along the side of the road while walking outside a company vehicle. the employee suffered a right shoulder fracture and required hospitalization.",OSHA,1
"fall from or working at height issue, head or face injury, foot or leg injury","other fall to lower level less than 6 feet an employee fell down from the third rung of an 8-foot ladder while installing electrical wiring, sustaining a bump and laceration that required stitches to the head.",OSHA,2
"fall from or working at height issue, burns",contact with hot objects or substances an employee was using a step ladder to clean a vent hood over the chicken fryer. he lost his balance and stepped onto the fryer removing the fryer lid. his right foot went into the hot oil resulting in burns to his foot and ankle.,OSHA,1
lifting or moving loads,"late entry due to it outageon october 2, 2018 at approximately 1515 a nacap 2” pipe spooling slid down the hides hill at kp1.35 to kp1.5 striking a mobile squad (ms) light vehicle (lv).  no one was hurt. migrated from legacy cairs incident #39852on october 2, 2018 at approximately 1515 a nacap 2” pipe spooling slid down the hides hill at kp1.35 to kp1.5 striking a mobile squad (ms) light vehicle (lv). no one was hurt. nacap was repositioning a welded ten (10) section(98.83m in length, &amp; 1.23tons), of 2” meg line (spool) from the top of hides hill (kp1.2) to an open cut trench at kp1.5-kp1.8. a 1” steel pin, pin-locked in place at the front end of the hdpe sleeve(120m long)was to prevent the 2"" spool from sliding out.the back-end of the 6""hdpe sleeve was then secured directly a 8ton excavator with a 5ton 2m rated soft sling and a 16mm synthetic rope secured the 2"" pipe spooling to the hdpe sleeve, the front-end of the hdpe sleevewas secured with a 5ton 2m rated soft sling attached to a 27ton nacap excavator. as the spool was being dragged down the hill, the synthetic rope allowed the 2"" pipespool slidethrough, this caused an impulse-moment when the 2"" pipe spool slid down the 6"" hdpe sleeve and hit the 1"" retaining pin at the end of the 6"" hdpe sleeve. this impulse-moment exceeded the resistant force of the pin-lock, the retaining-pin caused it to tear through the hdpe pipe, and allow the spool to slide out of the hdpe sleeve, down the hides hill. at the bottom of the hides hill was a ms lv, the spool struck the lv tire and damaged the suspension. the spool then came to rest approximately 40 meters outside the brown field right of way (brow) corridor. there was no indication for d&amp;a and it was not taken. migrated from legacy cairs - see detailed description",ORGP,1
bites (animals or insects),"other animal bites, nonvenomous a letter carrier went up on a porch to deliver mail to a home when a dog came out of an open window in the screen door and attacked her, biting the left side of her face. a second dog also attacked, biting her on the right calf. the employee was hospitalized and required reconstructive surgery on her facial wounds.",OSHA,1
"hand or arm injury, general injury","ip's arm caught on broken light tube causing a laceration. a broken tube light bulb had been left in a bucket outside.  the bucket is normally used for disinfecting ecology equipment.  i was filling up another bucket next to the one with the broken light bulb using a hose pipe.  i moved my arm and caught the edge of the broken bulb which pierced the skin, leaving a cut on my left forearm. ip went to reception to use the first aid kit and used an antiseptic wipe, but there were not plasters large enough to cover the wound so i was given one by a member of staff who had her own personal supply.",ORGP,1
covid,wood employees tested positive for covid 19. wood employees tested positive for covid 19. some employees have mild symptoms while other do not have any symptoms.  employees are in isolation and following government protocols.,ORGP,1
"hand or arm injury, general injury, foot or leg injury, fall from or working at height issue, slips & trips","other fall to lower level, unspecified an employee was climbing down a pallet of material. she slipped and fell to the ground, breaking her elbow and twisting her ankle.",OSHA,1
"line strike, hydraulic fluid or oil leak, fall from or working at height issue, hand or arm injury","employee was struck with nitrogen and debris from a gas-lift  line on his left hand/wrist area when he attempted to remove a leaking ½” inch plug from a blind flange. migrated from legacy cairs incident #36309after discovering a leaking ½” plug on a gas lift line that was being pressure tested with nitrogen, the nitrogen source was turn off and employee attempted to bleed down the piping utilizing a needle valve. when the pressure was relieved at the needle valve he proceed to the area with the leaking plug, attempted to remove it and was struck on the left wrist with nitrogen and debris. employee was prescribed antibiotic upon the doctor’s evaluation. migrated from legacy cairs - see detailed description",ORGP,2
head or face injury,"contact with objects and equipment, unspecified an employee was repairing the broken bucket of a conveyor when the machine moved, lacerating the employee's head and fracturing his jaw. the employee was hospitalized.",OSHA,1
"slips & trips, general illness or health issue, foot or leg injury","allergic reaction to food a piping designer was leaving the organisation and arranged for samosas to be delivered to the office. the ip, another piping designer who joined wood recently, took an allegoric reaction to the smell of the food and left the premises after informing her co-worker. she drove herself to a pick up point and then proceeded to a&e. at a&e she became dizzy and fell over. the fall resulted in a small fracture to her left ankle. she returned to work the next day and informed her line manager (alan bradford, lead piping engineer) of what had happened to her. she has list of substances that she is allergic to however said she was embarrassed to discuss the issue. ip went to hospital and while waiting to be seen by a dr for the allergic reaction, felt dizzy and fainted. the ip was then taken to a bed and seen by a dr for the allergic reaction. once the ip had stabilized, was then seen by a second dr for the injury to the foot. the ip was discharged and returned to work the following day.",ORGP,1
"back injury, general injury, foot or leg injury","employee experinced pain in the lower side of left foot while walking at ground level. an employee experienced pain in the lower side of his left foot when he was walking at ground level and stepped wrong to avoid a piece of pipe. employee was taken to the onsite medical clinic where he was evaluated, treated for a muscle strain with first aid measures, and released back to work without restrictions. after returning to work on 6-9-20 from a 3 day weekend the employee stated that he was still experiencing mild pain. as a precaution the employee was taken to an offsite clinic for further evaluation. the diagnosis at the offsite clinic was the same as the on-site diagnosis and no further treatment was rendered. the employee was released back to work without restrictions.",ORGP,1
"line strike, fall from or working at height issue, competency","a work crew excavating ground at the front of the site with a 6t excavation machine struck a buried 300mm underground storm pipe. the line strike caused the discharge of a large volume of water to excavated and adjoining area. the crew did not seek an underground services map for the area before commencing the work. the crew did not use a service tracker or perform a high-level evaluation of the site for existing services / storm routes / manholes, etc. the crew were relatively inexperienced and were operating in the area without senior oversight. recommend tool-box talk and safety briefing on the importance of following the correct procedures and protocols when excavating ground. provide 'safety moment' material from other incidents where line strike caused significant injuries or outages for use during the briefing sessions. overall awareness and competency for performing such dangerous work tasks should be improved. follow-up consultation planned for may-18.",MANF,2
slips & trips,"ip tripped on a cable but did not fall ip tripped on a cable at the end of the meeting room table, but regained balance. the cable connected a piece of equipment on the  table to a floor box, but was routed in front of the table.  action taken cable removed and checked room for other potential trip hazards.",ORGP,1
"general injury, dropped object or material, lifting or moving loads","struck by falling object or equipment, n.e.c. an employee was preparing to install a piece of steel angle iron when it fell from the top flange of a beam, striking the employee and causing a shoulder injury that required surgery.",OSHA,2
