category,text,dset,scores
"hand or arm injury, fall from or working at height issue, general injury","other fall to lower level, unspecified an employee fell from a truck to a lower level while moving a fuel hose, suffering a fractured hip and arm injury. the employee had surgery.",OSHA,1
mechanical or equipment issue,the auxiliary handle on a corded power drill broke off from drill body while in use. no injuries or damage involved. the employee inspected the drill prior to use and had all appropriate ppe on at time of incident. migrated from legacy cairs incident #39859the employee was using a corded power drill to drill holes in floor tiles when the auxiliary handle broke off. no injuries or damage occurred and employee removed the drill from service. the employee completed an inspection of the drill prior to use and was wearing the appropriate ppe for the job. migrated from legacy cairs - see detailed description,ORGP,1
"hazardous materials or work, competency","caught in running equipment or machinery during maintenance, cleaning  employees were exposed to caught-between hazards while cleaning the patty-maker machine in the grinding room of the meat department due to lack of training on lock-out/tag-out procedures.",OSHA,1
"slips & trips, foot or leg injury","ip tripped and hit his right knee against the concrete edge slab. a group of workers were working in the pump shelter area to replace a drainage pipe when a pump on auto mode started up suddenly, producing a loud pitch sound. the ip who was working near the pump, was shocked and left the work area in a hurry. his left foot got stuck underneath a valve and he tripped and hit his right knee against the concrete edge slab. the ip suffered a cut on his right knee. he was brought to the pier medical centre where he was given some stitches and medication. first aid was conducted to the ip and brought to the pier medical centre for treatment.",ORGP,1
"fall from or working at height issue, competency, line strike","a work crew excavating ground at the front of the site with a 6t excavation machine struck a buried 300mm underground storm pipe. the line strike caused the discharge of a large volume of water to excavated and adjoining area. the crew did not seek an underground services map for the area before commencing the work. the crew did not use a service tracker or perform a high-level evaluation of the site for existing services / storm routes / manholes, etc. the crew were relatively inexperienced and were operating in the area without senior oversight. recommend tool-box talk and safety briefing on the importance of following the correct procedures and protocols when excavating ground. provide 'safety moment' material from other incidents where line strike caused significant injuries or outages for use during the briefing sessions. overall awareness and competency for performing such dangerous work tasks should be improved. follow-up consultation planned for may-18.",MANF,2
hand or arm injury,"struck by swinging part of powered vehicle an employee was washing the back of a dump truck. the latches for the back gate were stuck closed, and the employee lifted them up to allow the gate to close. the gate closed and pinched his right middle finger, causing an amputation to the fingertip.",OSHA,1
near miss,"near miss by moving a live emergency shutdown switch on sunday june 23rd at 11:00 am it was reported at drillsite 2 module 4911 fire and gas project that an esd (emergency shut down switch) box beside the entry door on the west side had been unbolted and moved then secured the day before at approx. 1330. it was discovered by the bp qa assigned to the project. the contractor’s construction lead and general foreman looked the area over and thought that the esd box was going to be demo’ed after the new fire and gas system was operating and the box was in the way for the new cable coming down the wall that needed to be routed into the new halon manual pull station that has been installed as part of the new fire and gas system. they called the drill site operator and told him what they had planned to do, and the operator gave his approval. the operator and crew talked about moving the esd out of the way during the morning toolbox talk and the precautions that needed to be taken if they did move the box but did not document it on the permit. the red box containing the esd is not getting replaced as part of the new system and was mis-identified by the construction lead. there was no potential to harm people but there was potential for the drill site to be shut down. esd box was reinstalled in its previous location.",ORGP,1
covid,two members of contractor project team tested positive for covid-19 workers arrived on site between feb 2-6. these positives were detected by the regular pcr swabs taken on days 5-7. isolation initiated.,ORGP,1
foot or leg injury,"fall from collapsing structure or equipment 6 to 10 feet an employee was riding an elevator up to the 5th floor when the elevator suddenly stopped and jerked, falling about 6 feet and tossing the employee to the floor. he broke his right leg in three places.",OSHA,2
"hand or arm injury, slips & trips",injured by slipping or swinging object held by injured worker an employee hurt his finger while using a screwdriver to perform electrical work.,OSHA,1
"hand or arm injury, general injury","worker bumped elbow on steel support resulting in small bruise.  no treatment case worker: abel rei (blaster/painter) – wood employee. work area: hgcp – area 600 – eqr task. narrative:  a worker was removing bolts using a spanner in a tight space in area 600, hgcp. he was applying force to the nut using an under-hand technique - pulling towards his body - when the bolt loosened dynamically. the workers arm continued in the direction of the pull and his elbow impacted a vertical steel support.   note: the spanner did not slip from the nut itself.       actions: the worker immediately reported the event to his supervisor and was brought to the hse coordinator. •	client advised. •	taken to the clinic for assessment: no breaking of the skin, slight discolouration to impact area on tip of elbow. •	outcome – no treatment case (ntc). worker to resume normal duties and return to clinic if discomfort continues. •	client advised of outcome.   ip taken to clinic for assessment.  ",ORGP,1
covid,a wood employee tested positive for covid-19.  a wood employee received a positive covid-19 test result on 3/1/2021.  the wood employee was experiencing symptoms and scheduled a covid 19 test which was a positive result.  contact tracing has been completed. the employee has self quarantined and has notified management.  wood on site management has conducted contact tracing and notification to client.  ,ORGP,1
foot or leg injury,"a worker placing concrete forms bumped his shin with a hammer resulting in discomfort in his shin. first aid event. migrated from legacy cairs incident #33999a worker was swinging a hammer in the process of building concrete formwork. as he swung up, the hammer contacted the string line then contacted his shinthe contact with the hammer resulted in discomfort in his shin. axiom medical was contacted and first aid measures were administered. migrated from legacy cairs - see detailed description",ORGP,1
"hand or arm injury, general injury","exposure through intact skin, eyes, or other exposed tissue the injured employee was in the process of spraying a tacky solution onto the conveyor belt of a dump truck when his arm got caught and he received skin burns/abrasions on his left forearm and left hand. he was admitted to the hospital and had an incision to relieve the swelling.",OSHA,1
"lifting or moving loads, fall from or working at height issue, foot or leg injury, vehicle incident general","nonroadway collision with other vehicle, unspecified while traveling on a walkie stacker, an employee struck a coworker's forklift and suffered a left leg injury.",OSHA,2
