category,text,dset,scores
"slips & trips, fall from or working at height issue, head or face injury","other fall to lower level, unspecified an employee performing custodial work (sweeping in stairwell) misjudged his step and fell striking his head on september 12, 2015 at 2:30 am. the employee was admitted to the hospital. the employee sustained contusions and lacerations to the head.",OSHA,1
"head or face injury, line strike","struck by dislodged flying object, particle an employee was hydrostatic pressure-testing a section of pipeline when a pipe coupling separated and struck him in the face, lacerating his upper lip and causing dental trauma.",OSHA,2
"hand or arm injury, competency",site worker ripped his index finger while installing tying wire on rebar cage. the ip received a one inch laceration/cut to his index finger that required 20 stitches. the worker stepped into to help expedite the steel fixing team that were under pressure to complete a ground beam cage for a scheduled afternoon concrete pour. the ip was not certified or trained to be performing steel fixing work. the site foreman was unaware that the ip was involved in the tying. senior members of the steel fixing crew should have intervened when the ip volunteered to assist with the work. the incident is to be raised during the weekly all-hands safety awareness briefing.,MANF,1
"lifting or moving loads, vehicle incident general","pipe drifted during tandem lift causing minor damage to a generator. area was barricaded and all personnel were removed from the area. riggers and crane operators were attempting to upright a section of outlet piping (46-inch diameter, 65-foot length). a liebherr lr-1200 crane was lifting the pipe while a 120-ton tadano crane was holding the bottom end of the outlet pipe (i.e. tandem lift). as the liebherr crane began to upright the outlet pipe, the pipe began to slightly drift. in the process of the pipe drifting, the bottom end of the pipe (being held by the tadano crane) floated to a nearby superheat generator and made minor contact. the aera of the lift was barricaded and all employees had been removed from immediate area. a critical lift plan was completed prior to the initiation of the lift. load was redirected and the pipe was returned to a horizontal position. incident was reported and investigation was initiated.",ORGP,1
"hand or arm injury, fall from or working at height issue",pedestrian struck by vehicle backing up in nonroadway area an employee was carrying trash outside to the burning pit using a forklift. the forklift got stuck in the mud outside and the operator asked another forklift operator to pull the stuck forklift out of the mud. the second forklift was backing up to the stuck forklift to attach a chain. the injured employee was holding the chain and while the second forklift backed up and the employee's left arm was crushed between the two forklifts resulting in amputation of the arm.,OSHA,2
covid,uk expat tested positive for covid-19 during fit to travel pcr test. ip is asymptomatic. ip was due to depart eg on the 22nd of september. as part of covid-19 restrictions ip reported to punta europa clinic for pre-travel pcr testing and the results came back positive for covid-19. ip is asymptomatic.   due to positive results for covid-19 ip will complete onsite mandatory 14 day quarantine in usual accommodation. ip will be required to re-test prior to being deemed fit to return to work and be able to travel. pm will remain in regular communication with ip and onsite clinic physicians will also monitor ip condition.  ,ORGP,1
"hand or arm injury, fall from or working at height issue, head or face injury","whilst conducting bolt torqueing activities a (3/4) x 2 (3/4) bolt popped while being tightened with an impact gun. half of the bolt  weighing approximately 3.5 oz. fell approximately 40 ft., hitting two persons before falling to grade. migrated from legacy cairs incident #34557on september 8 2017, at approximately 3:15pm, two monar fitters were involved in a bolt torqueing exercise on train 4 cold box area, on the ctme project. the job entailed securing structural supports with the use of ¾ x 2 ¾ galvanize bolts with the aid of an impact gun and a back up spanner. the activity was performed at height on a scaffold platform approximately 43ft from grade.a popping sound was heard in the process of torqueing the bolt. it was later discover, that the bolt was torn apart into two pieces. one piece remained within the impact gun and the other piece fell within the barricaded area, striking two massy fabric maintenance scaffolders who were working within the barricaded area at the time. one person hit to the back of his head, and the other to the back of his right hand.the job was stopped immediately and a stand down held with all contractor personnel. both injured persons were escorted to the atlantic site occupational health nurse for and assessment of the affected areas. one person was immediately discharged and the other referred to the petrotrin area hospital for treatment and further assessment. he was administered over the counter drugs and an ice pack.on 12 september 2017, he re-visited the atlantic doctor as per established protocol for another assessment. he was discharged and issued a fit to work certificate. migrated from legacy cairs - see detailed description",ORGP,2
"covid, fall from or working at height issue",individual tested positive for covid-19 while on board balmoral platform individual was on board balmoral platform when they were contacted through track and trace. a covid test was carried out and the individual has tested positive. the individual has no symptoms. individual was medevac'd on sunday 24th and arrived back in aberdeen on 24th january. a taxi was arranged for them to be taken to the crowne plaza where they are now staying. individual was isolated and medevac'd back to aberdeen as early as possible. they were then taken to the crowne plaza hotel in aberdeen where they are currently staying.,ORGP,2
"slips & trips, back injury, general injury","struck by falling part of powered vehicle still attached an employee leaned against the left upright batwing of a rhino mower that came unhooked and fell onto the employee. the employee suffered four broken ribs and three fractured vertebrae (l2, l3, l4).",OSHA,2
"hand or arm injury, general injury","thrown, fell, or jumped from animal being ridden a trail guide was bucked off while attempting to get on his horse. he landed on his right side and fractured his hip and wrist.",OSHA,1
"slips & trips, back injury","fall on same level due to tripping over an object  an employee was filling a store order. while lifting a 40-pound bag of onions from a pallet, he tripped over shrink wrap that was attached to the pallet. the employee fell to the floor sustaining a swollen disk and lower back pain requiring hospitalization.",OSHA,1
covid,wood employee tested positive for covid-19 wood employee who is working from home reported on nov 23th through covid app symptoms associated to covid. he reported that he had contact with family member who was diagnosed positive for covid 19. on november 23rd his medical service took a test for covid 19. he received the result on nov 26th as positive. he is recovering at home. employee reported to his supervisor and hsse.recommendations was sending to employee for his care.,ORGP,1
covid,one wood employee tested positive for covid 19. one wood employee developed mild symptoms and tested positive for covid 19 while aboard mp 283. ee was sent in for home quarantine and will monitor the condition. contact tracing is complete.  ee sent in for home quarantine and facility covid protocols in place. ,ORGP,1
competency,"a last-minute site visit was requested for the project. an employee was sent to site without having the required induction or site safety training, as the dispatching office thought neither credentials were required due to being escorted by a cat 5 safety watch. the deficiency was noted when the hse department reviewed the journey management plan and noted the lack of required pre-access training. the site visit was cancelled and the employee left the site.",MANF,1
covid,wood employee confirmed positive with covid 19 employee confirmed positive with covid 19.  7-10 days observation in hospital14 days self-isolation on release  ,ORGP,1
"slips & trips, foot or leg injury","fall on same level due to slipping  an employee was exiting a vehicle on a mail route when the employee slipped and fell to the ground, fracturing the right leg. the employee was hospitalized.",OSHA,1
hand or arm injury,"electrical helper pulled ground wire cable through an underground bore when the cable jerked resulting in discomfort in the helper's wrist on april 15th, 2021 at approximately 2:50 pm, an electrical helper was second in line, of a crew of nine, providing assistance in pulling 4 ot cable (approximately 1/2” in diameter) ground wire through an underground bore. the helper was positioned with their hands holding the wire over their right shoulder, as they pulled the wire.  the helper pulled the wire through the bore and the cloth, attached at the end of the wire, caught on a “weld” that connects the two pieces of boring pipe together. this act resulted in pulling the helper’s arm in a backwards jerking motion, causing discomfort in their right wrist. the actual severity is an b1 due to the ip receiving first aid treatment (otc anti-inflammatories & ice). the potential severity was also classified as a b1 due to there being no potential for a medical treatment.   the helper notified their supervisor who notified hsse.  the ip was escorted to the onsite medic for evaluation and first aid treatment (otc anti-inflammatories & ice) was provided. investigation protocols were initiated.",ORGP,1
"fall from or working at height issue, general injury","other fall to lower level, unspecified an employee was on a ladder cutting an overhead beam. the ceiling beam collapsed and struck the employee, causing him to fall off and sustain a rib injury.",OSHA,1
"hand or arm injury, foot or leg injury, lifting or moving loads",small abrasion to toe when struck foot against bathroom doorway small abrasion to base of nail bed approx. 3mm. cleansed and dressed using first aid measures. reported to medic,ORGP,2
back injury,pipe fitter felt discomfort to the lower back when installing cladding on pipework pipe fitter felt discomfort to the lower back when installing cladding on pipework  hse notified. ip was assessed at site medical centre where over the counter pain relief was administered. ip returned to work with no restriction.,ORGP,1
covid,"positive covid-19 result, home acquired employee received positive covid-19 test result. virus was home acquired, employee was on site thursday and friday but did not have close contact with anyone. contact tracing began.",ORGP,1
covid,employee communicated a positive confirmation for covid-19  an employee reported a confirmed positive test for covid-19 to site management. the employee has been in isolation. wood is identifying those who may have worked in proximity.  appropriate notifications have been completed. this is the second of two positive test results for the 10th of july.,ORGP,1
"fuel spill or leak, hydraulic fluid or oil leak","spill containment cracked and leaked oil onto the ground. client safety noticed an oil leak under a light plant by the containment used to catch spills under a light plant.  the containment was cracked and leaked approximately a quart of oil on the ground.  a1 was selected as the actual severity rating because the spill caused minimal impact to the environment.  a1 was selected as the potential severity rating because it's not feasible that enough oil could have leaked onto the ground to cause a greater environmental impact. light plant that leaked was replaced.  dirt containing oil was removed along with the cracked containment.  both were disposed of in a 55 gal drum, which was then properly labled.  new containment was placed underneath the light plant.",ORGP,1
lifting or moving loads,"backed into excavator bucket mva involving heavy equipment.  while leaving job site to get lunch, employee struck an excavator bucket while backing out of parking area.  no visible damage to excavator.  no injuries. incident reported. owner of excavator notified and insurance claim filed for amecfw vehicle.",ORGP,2
"foot or leg injury, vehicle incident general","pedestrian struck by forward-moving vehicle in work zone  an employee was painting a newly paved road when a vehicle struck him, breaking both of his legs and one of his shoulders.",OSHA,1
hand or arm injury,"caught in running equipment or machinery, n.e.c. an employee was checking the tension on a belt on a vehicle. the employee's left hand was pulled into the belt and pulley, causing a partial amputation of the left index finger.",OSHA,1
hand or arm injury,"caught in running equipment or machinery, unspecified at 2:40 a.m. on october 16, 2019, an employee was working on the cold foil web unit on a press. while the employee was webbing the ancillary piece of equipment with the foil, the press was jogged and the employee's finger was partially amputated.",OSHA,1
hand or arm injury,"explosion of pressure vessel, piping, or tire an employee was repairing a tire and determined there was bulge on the side wall of the tire. the tire ruptured, knocking the employee over. the employee sustained a fractured arm and was hospitalized.",OSHA,1
hand or arm injury,struck by discharged object or substance an employee was using a pneumatic nail gun when the gun nailed the back of the employee's left hand.,OSHA,1
hand or arm injury,"caught in running equipment or machinery during maintenance, cleaning  an employee was diagnosing a problem with the air conditioner in a car when a belt possibly activated, causing amputation injuries to the left index and middle fingers.",OSHA,1
covid,ip tested positive for covid. ip tested positive for covid. ip isolated. no ccs,ORGP,1
"competency, vehicle incident general","a worker was reversing a vehicle with trailer towards the rear of the site when the he jack-knifed the trailer and caused damage to the rear of the vehicle. the weather was good, it was a bright day with no rain or wind - good visibility.  the worker involved in the incident said that it was his first time to reverse a vehicle with a trailer. his driving license did not cover movement of loads in a trailer of the size involved in the incident. the worker did not have the required competence or training to perform the task. no injuries were reported. he will meet with his supervisor on friday to discuss training and ticket requirements. the worker has been told that he cannot drive a site vehicle with trailer until he has the required training and certification/license.",MANF,1
"vehicle incident general, hydraulic fluid or oil leak","a forklift was discovered with undetermined leak (approx 6 oz) onto pavement. the rental company was notified and the forklift was removed from the site. the area was cleaned per client protocol. migrated from legacy cairs incident #36650two areas of pavement were observed with what appeared to be hydraulic fluid on them. upon investigation a forklift was discovered with a leak from an undetermined source. the forklift was taken out of service, and the rental company was contacted to remove it from the plant. an estimated 6 oz. of fluid leaked from the equipment. the spilled material was cleaned up per plant environmental procedure. migrated from legacy cairs - see detailed description",ORGP,1
"lifting or moving loads, vehicle incident general","a driver was sideswiped while driving by a vehicle which was merging into traffic causing minimal damage to the front fender of the truck. migrated from legacy cairs incident #30717a sbi driver was driving to the denver, co airport and as he was doing so a vehicle on his passenger side merged into his lane and hit him in the front tire causing minimal damage to the front fender. the driver which struck the sbi vehicle attempted to evade the scene and ultimately pulled over to exchange driver information. no injury was sustained. migrated from legacy cairs - see detailed description",ORGP,2
hand or arm injury,"caught in or compressed by equipment or objects, unspecified an employee's hand was caught in the plant removal roller and wrenched.",OSHA,1
weather related issue,exposure to environmental heat an employee was wiring field mass meters by the flare when he started feeling the effects of heat related illness. the employee was working with another employee at the time of the incident.  the paramedics were called and the employee was transported to the hospital.,OSHA,2
"dropped object or material, lifting or moving loads","struck by falling object or equipment, unspecified employees were making a connection when tubing fell striking the employee in the lower face.",OSHA,2
"slips & trips, general injury","fall on same level due to tripping over an object  an employee was stepping in and out of a cardboard gaylord container through a cutout, retrieving small merchandise items from the container. while stepping out of the container, the employee tripped on the bottom of the cutout and fell to the concrete floor. the employee suffered a broken right hip and was hospitalized.",OSHA,1
"fall from or working at height issue, head or face injury","other fall to lower level less than 6 feet on 11/9/15, an employee was sliding a dolly across a dock when he fell approximately 3 feet off the dock and hit his head. he lost consciousness and was hospitalized.",OSHA,1
vehicle incident general,"an employee was backing a vehicle when he came in contact with another vehicle that had parked in a no parking zone.  minor damage to the vehicle. migrated from legacy cairs incident #34792on wednesday, october 18, 2017 at 5:00 pm at dow freeport an civil employee was backing a vehicle when he came in contact with another vehicle that had parked in a no parking zone. minor damage to the vehicle. migrated from legacy cairs - see detailed description",ORGP,1
lifting or moving loads,"mewp impacted rear end of escort vehicle (van) resulting in damage to tailgate. migrated from legacy cairs incident #31416lngp: at 0910, mewp was being escorted by van back to maintenance via the road. mewp distance between escort vehicle approximately 3m. escort slowed down to warn other traffic of mewp. mewp operator was checking vehicle traffic behind at the same time. mewp operator on realizing too close to escort vehicle went to stop however did not stop in time. knuckle part of the boom contacted the tailgate of the escort vehicle. tailgate of escort vehicle damaged. no injuries sustained. stand down for safety held withbetween all wg site management and wg construction workforceafter the incidentinvestigation underway migrated from legacy cairs - see detailed description",ORGP,2
"hand or arm injury, fall from or working at height issue","struck by object or equipment, unspecified an employee was on the roof (new two story house) fixing an incorrectly installed metal flashing. as he was lifting the metal flashing to add a peel stick, a roof drip edge flashing came out of its box and landed on his left hand, resulting in the amputation of his left middle finger from the first joint.",OSHA,1
"covid, disease or infection",a wood employee tested positive for covid 19 during premobilization screening.  a wood employee tested positive for covid 19 during premobilization screening. ee is asymptomatic and returned home for quarantine. no contact tracing required.  ee instructed to return home and quarantine. ,ORGP,1
"slips & trips, foot or leg injury","subcontractor ee walking across dcs room, bumped unsecured hole cover with foot, stepping into open hole. subcontractor employee was walking through de-watering building dcs room when he bumped an unsecured cover protecting a floor penetration intended for cable access with his foot causing the plywood cover to slide from over the opening, and tripped into the open cable access floor penetration scraping his shin and bumping his right knee on the edge of the opening. the cable penetration cover was not secured or labeled correctly. cable access penetration was immediately secured and the permanent equipment was installed to prevent reoccurrence. investigation as to who installed the cover and why it was not secured properly is still ongoing. a stand-down was held with electrical crew involved. event will be discussed with all site employees at all hands meeting tomorrow (12/5/2017) morning. a memo addressing proper covers and other life critical topics is being drafted for distribution to all employees.",ORGP,1
"slips & trips, general injury","fall on same level due to tripping, unspecified an employee tripped while turning and fell to the floor, suffering a broken hip.",OSHA,1
"slips & trips, general injury","other fall to lower level less than 6 feet an employee was standing on a pipe railing that was approximately 2 feet high while he was cleaning out a fertilizer blender. he slipped off of the rail and fell, resulting in three broken ribs and a possible punctured lung.",OSHA,1
"slips & trips, general injury","fall on same level due to tripping over self an employee tripped over his feet while vacuuming and fell, landing on and breaking his right hip. he was hospitalized and had surgery.",OSHA,1
"hand or arm injury, slips & trips, fall from or working at height issue, head or face injury","other fall to lower level, unspecified an employee was standing on a rolling safety ladder/platform, testing a machine that had been assembled. he fell to the floor, hitting his head, breaking his jaw on the left side, and suffering broken fingers on his left hand.",OSHA,1
hand or arm injury,metal flashing on pallet caught finger and resulted in cut to right index finger. firstaid applied & ip returned back to work with full duty ip was tucking tarp under wooden pallet. backside of right hand index finger brushed against metal flashing on pallet outside of glove protective coating (cut resistant). minor cut sustained to backside of right hand index finger. incident reported immediately to site supervision. basic first aid applied and ip returned back to work with full duties.  first aid administered to ip immediately. client notified. duty officer notification sent out.,ORGP,1
hand or arm injury,caught in running equipment or machinery during regular operation an employee was attaching an air hose to the discharge area of an inserter machine. the engage button was bumped and the air pressure engaged the clamp which shut on his right middle finger amputating the fingertip.,OSHA,1
covid,"wood employee was in monitoring pre-embark to ppm-1, performed the covid-19 test  and the result was positive. wood employee was in monitoring pre-embark to ppm-1, performed the covid-19 test  and the result was positive. the ip is asymptomatic. the worker is asymptomatic. the ip received guidance from the nursing technician regarding the necessary care and will be sent home for quarantine period.",ORGP,1
hand or arm injury,"whilst lifting a stone onto a dry stone wall, ip broke the tip of his finger. the crossaig office site is being reinstated back to its original state. whilst lifting a stone onto a dry stone wall the a&a foreman got his finger trapped and broke the tip of his finger, resulting in medical treatment - sutures required. all worked was stopped and ip was driven to hospital at campbeltown.",ORGP,1
"slips & trips, foot or leg injury","fall on same level due to slipping  on july 28, 2020, an employee was doing housekeeping at the end of his shift. as he walked across the work area after emptying a trash can, he slipped in oil and fell, suffering a left ankle injury that required hospitalization and surgery.",OSHA,1
"hand or arm injury, fall from or working at height issue","compressed or pinched by shifting objects or equipment an employee was using a forklift to stack two boxes when her right hand was caught between a box and the forklift forks, resulting in a right index finger amputation.",OSHA,2
"fall from or working at height issue, foot or leg injury","part of occupantís body caught between vehicle and other object in nonroadway transport incident an employee was operating a stand-up forklift when he ran into a guard railing. he struck and injured his knee, requiring hospitalization.",OSHA,2
"hand or arm injury, slips & trips","caught in running equipment or machinery, unspecified an employee was monitoring a mud pump and slipped on a slick surface. while bracing for a fall, the employee contacted a belt and pulley on a pump. his right middle finger was lacerated just above the first knuckle and the fingertip had to be surgically amputated.",OSHA,1
"fall from or working at height issue, general injury",other fall to lower level 11 to 15 feet  an employee fell from the leading edge of a 15-foot-high roof to the ground. the employee suffered broken ribs.,OSHA,1
"slips & trips, eye injury or irritation","foreign debris in eye wood e&i technician (iw) was helping to install cable into an overhead cable tray when he bumped his head on an overhead object. when the worker looked up to see what he had bumped into, grit/debris fell from the cable tray onto the bridge of his nose, some of which entered the corner of his left eye. the iw subsequently attended site first aid where the grit was flushed out and the iw returned to work. the iw was wearing a hard hat with sun brim and clear safety glasses at the time. worker attended first aid where grit was flushed out. hse advisor liaised with e&i supervisor and spoggles or mono goggles mandated for crew working on that task.",ORGP,2
